title,released_year,run_time,stars,total_ratings,summary,Action,Adventure,Sci-Fi,Comedy,Drama,Romance,Thriller,Fantasy,Horror,Mystery,Crime,Adults,Kids,Other,Teens
The Impossible,2012.0,2.0,7.5,242000.0,The story of a tourist family in Thailand caught in the destruction and chaotic aftermath of the 2004 Indian Ocean tsunami.,0.0,0.0,0.0,0.0,1.0,0.0,1.0,0.0,0.0,0.0,0.0,False,False,False,True
Hercules,1997.0,2.0,7.3,253000.0,The son of Zeus and Hera is stripped of his immortality as an infant and must become a true hero in order to reclaim it.,0.0,1.0,0.0,1.0,0.0,0.0,0.0,0.0,0.0,0.0,0.0,False,True,False,False
Waiting,2005.0,2.0,6.7,105000.0,Young employees at ShenaniganZ restaurant collectively stave off boredom and adulthood with their antics.,0.0,0.0,0.0,1.0,0.0,0.0,0.0,0.0,0.0,0.0,0.0,False,False,True,False
Talladega Nights: The Ballad of Ricky Bobby,2006.0,2.0,6.6,198000.0,"Number one NASCAR driver Ricky Bobby stays atop the heap thanks to a pact with his best friend and teammate, Cal Naughton, Jr. But when a French Formula One driver, makes his way up the ladder, Ricky Bobby's talent and devotion are put to the test.",0.0,0.0,0.0,1.0,0.0,0.0,0.0,0.0,0.0,0.0,0.0,False,True,False,False
Batman v Superman: Dawn of Justice,2016.0,0.0,6.5,749000.0,Batman is manipulated by Lex Luthor to fear Superman. Superman´s existence is meanwhile dividing the world and he is framed for murder during an international crisis. The heroes clash and force the neutral Wonder Woman to reemerge.,1.0,1.0,1.0,0.0,0.0,0.0,0.0,0.0,0.0,0.0,0.0,False,True,False,False
Kindergarten Cop,1990.0,2.0,6.2,161000.0,"A tough cop must pose as a kindergarten teacher in order to locate a dangerous criminal's ex-wife, who may hold the key to putting him behind bars.",1.0,0.0,0.0,1.0,0.0,0.0,0.0,0.0,0.0,0.0,1.0,False,True,False,False
A Simple Favor,2018.0,2.0,6.8,161000.0,"Stephanie is a single mother with a parenting vlog who befriends Emily, a secretive upper-class woman who has a child at the same elementary school. When Emily goes missing, Stephanie takes it upon herself to investigate.",0.0,0.0,0.0,1.0,0.0,0.0,0.0,0.0,0.0,1.0,1.0,False,False,False,True
Birth,2004.0,2.0,6.2,40000.0,A young boy attempts to convince a woman that he is her dead husband reborn.,0.0,0.0,0.0,0.0,1.0,0.0,0.0,1.0,0.0,1.0,0.0,False,False,False,True
Bone Tomahawk,2015.0,1.0,7.1,117000.0,"In the dying days of the old west, an elderly sheriff and his posse set out to rescue their town's doctor from cannibalistic cave dwellers.",0.0,0.0,0.0,0.0,1.0,0.0,0.0,0.0,1.0,0.0,0.0,False,False,True,False
The Homesman,2014.0,1.0,6.6,35000.0,"Three women who have been driven mad by pioneer life are to be transported across the country by covered wagon by the pious, independent-minded Mary Bee Cuddy, who in turn employs low-life drifter George Briggs to assist her.",0.0,0.0,0.0,0.0,1.0,0.0,0.0,0.0,0.0,0.0,0.0,False,False,False,True
Snowpiercer,2013.0,1.0,7.1,387000.0,"In a future where a failed climate change experiment has killed all life except for the survivors who boarded the Snowpiercer (a train that travels around the globe), a new class system emerges.",1.0,0.0,1.0,0.0,1.0,0.0,0.0,0.0,0.0,0.0,0.0,False,False,False,True
Black Hawk Down,2001.0,1.0,7.7,421000.0,"The story of 160 elite U.S. soldiers who dropped into Mogadishu in October 1993 to capture two top lieutenants of a renegade warlord, but found themselves in a desperate battle with a large force of heavily armed Somalis.",1.0,0.0,0.0,0.0,1.0,0.0,0.0,0.0,0.0,0.0,0.0,True,False,False,False
A Bronx Tale,1993.0,1.0,7.8,159000.0,"Robert De Niro and Chazz Palminteri give captivating performances in this intense drama about a boy torn between his tough, hard-working father and a violent yet charismatic crime boss.",0.0,0.0,0.0,0.0,1.0,0.0,0.0,0.0,0.0,0.0,1.0,False,False,False,True
Don Jon,2013.0,2.0,6.5,246000.0,"A New Jersey guy dedicated to his family, friends, and church, develops unrealistic expectations from watching porn and works to find happiness and intimacy with his potential true love.",0.0,0.0,0.0,1.0,1.0,1.0,0.0,0.0,0.0,0.0,0.0,False,False,True,False
Justice League: Crisis on Infinite Earths - Part One,2024.0,2.0,6.3,3200.0,"The Anti-Monitor (the Monitor's evil counterpart) is released in the DC Multiverse and begins to destroy the different Earths that compose it. The Monitor attempts to recruit heroes from across the Multiverse, but is murdered.",1.0,1.0,0.0,0.0,0.0,0.0,0.0,0.0,0.0,0.0,0.0,False,False,False,True
The Karate Kid,1984.0,1.0,7.3,243000.0,A martial arts master agrees to teach karate to a bullied teenager.,1.0,0.0,0.0,0.0,1.0,0.0,0.0,0.0,0.0,0.0,0.0,False,True,False,False
Slap Shot,1977.0,1.0,7.3,41000.0,A failing ice hockey team finds success with outrageously violent hockey goonery.,0.0,0.0,0.0,1.0,1.0,0.0,0.0,0.0,0.0,0.0,0.0,False,False,False,True
Star Trek,2009.0,1.0,7.9,619000.0,The brash James T. Kirk tries to live up to his father's legacy with Mr. Spock keeping him in check as a vengeful Romulan from the future creates black holes to destroy the Federation one planet at a time.,1.0,1.0,1.0,0.0,0.0,0.0,0.0,0.0,0.0,0.0,0.0,False,True,False,False
Brokeback Mountain,2005.0,1.0,7.7,380000.0,Ennis and Jack are two shepherds who develop a sexual and emotional relationship. Their relationship becomes complicated when both of them get married to their respective girlfriends.,0.0,0.0,0.0,0.0,1.0,1.0,0.0,0.0,0.0,0.0,0.0,False,False,False,True
Baywatch,2017.0,2.0,5.5,201000.0,"Devoted lifeguard Mitch Buchannon butts heads with a brash new recruit, as they uncover a criminal plot that threatens the future of the bay.",1.0,0.0,0.0,1.0,0.0,0.0,0.0,0.0,0.0,0.0,1.0,False,False,False,True
Men in Black,1997.0,2.0,7.3,608000.0,"James, an NYC cop, is hired by Agent K of a secret government agency that monitors extraterrestrial life on Earth. Together, they must recover an item that has been stolen by an intergalactic villain.",1.0,1.0,0.0,1.0,0.0,0.0,0.0,0.0,0.0,0.0,0.0,False,True,False,False
Superman,1978.0,1.0,7.4,186000.0,"An alien orphan is sent from his dying planet to Earth, where he grows up to become his adoptive home's first and greatest superhero.",1.0,1.0,1.0,0.0,0.0,0.0,0.0,0.0,0.0,0.0,0.0,False,True,False,False
Skyfall,2012.0,1.0,7.8,728000.0,"James Bond's loyalty to M is tested when her past comes back to haunt her. When MI6 comes under attack, 007 must track down and destroy the threat, no matter how personal the cost.",1.0,1.0,0.0,0.0,0.0,0.0,1.0,0.0,0.0,0.0,0.0,False,False,False,True
Once Upon a Time in the West,1968.0,0.0,8.5,347000.0,A mysterious stranger with a harmonica joins forces with a notorious desperado to protect a beautiful widow from a ruthless assassin working for the railroad.,0.0,0.0,0.0,0.0,0.0,0.0,0.0,0.0,0.0,0.0,0.0,False,False,False,True
Malignant,2021.0,2.0,6.2,108000.0,"Madison is paralyzed by shocking visions of grisly murders, and her torment worsens as she discovers that these waking dreams are in fact terrifying realities.",0.0,0.0,0.0,0.0,0.0,0.0,0.0,0.0,1.0,1.0,1.0,False,False,False,True
Old Dads,2023.0,2.0,6.2,38000.0,"Three best friends become fathers later in life and find themselves battling preschool principals, millennial CEOs, and anything created after 1987.",0.0,0.0,0.0,1.0,0.0,0.0,0.0,0.0,0.0,0.0,0.0,True,False,False,False
Kingsman: The Golden Circle,2017.0,1.0,6.7,360000.0,"After the Kingsman's headquarters is destroyed and the world is held hostage, an allied spy organization in the United States is discovered. These two elite secret agencies must band together to defeat a common enemy.",1.0,1.0,0.0,1.0,0.0,0.0,0.0,0.0,0.0,0.0,0.0,False,False,False,True
Eagle,2024.0,0.0,8.2,2900.0,A journalist uncovers the story of a ruthless assassin when she investigates a government cover up.,1.0,0.0,0.0,0.0,0.0,0.0,1.0,0.0,0.0,0.0,0.0,False,False,False,True
WALL·E,2008.0,2.0,8.4,1200000.0,"In the distant future, a small waste-collecting robot inadvertently embarks on a space journey that will ultimately decide the fate of mankind.",0.0,1.0,0.0,0.0,0.0,0.0,0.0,0.0,0.0,0.0,0.0,False,True,False,False
Unthinkable,2010.0,2.0,7.0,92000.0,Follows a black-ops interrogator and an F.B.I. agent who try to press a suspect terrorist into divulging the location of three nuclear weapons set to detonate in the U.S.,0.0,0.0,0.0,0.0,1.0,0.0,1.0,0.0,0.0,0.0,1.0,True,False,False,False
Star Wars: Episode VI - Return of the Jedi,1983.0,1.0,8.3,1100000.0,"After rescuing Han Solo from Jabba the Hutt, the Rebels attempt to destroy the second Death Star, while Luke struggles to help Darth Vader back from the dark side.",1.0,1.0,0.0,0.0,0.0,0.0,0.0,1.0,0.0,0.0,0.0,False,True,False,False
365 Days: This Day,2022.0,2.0,2.7,24000.0,Laura and Massimo are back and stronger than ever. But Massimo's family ties and a mysterious man bidding for Laura's heart complicate the lovers' lives.,0.0,0.0,0.0,0.0,1.0,1.0,0.0,0.0,0.0,0.0,0.0,True,False,False,False
13 Going on 30,2004.0,2.0,6.3,214000.0,"Unpopular schoolgirl Jenna Rink makes an unusual wish on her birthday. Miraculously, her wish comes true and the 13-year-old Jenna wakes up the next day as a 30-year-old woman.",0.0,0.0,0.0,1.0,0.0,1.0,0.0,1.0,0.0,0.0,0.0,False,True,False,False
Minority Report,2002.0,1.0,7.6,581000.0,"John works with the PreCrime police which stop crimes before they take place, with the help of three 'PreCogs' who can foresee crimes. Events ensue when John finds himself framed for a future murder.",1.0,0.0,0.0,0.0,0.0,0.0,0.0,0.0,0.0,1.0,1.0,True,False,False,False
21 Jump Street,2012.0,2.0,7.2,595000.0,A pair of underachieving cops are sent back to a local high school to blend in and bring down a synthetic drug ring.,1.0,0.0,0.0,1.0,0.0,0.0,0.0,0.0,0.0,0.0,1.0,False,False,False,True
Anna,2019.0,2.0,6.6,92000.0,Beneath Anna Poliatova's striking beauty lies a secret that will unleash her indelible strength and skill to become one of the world's most feared government assassins.,1.0,0.0,0.0,0.0,0.0,0.0,1.0,0.0,0.0,0.0,0.0,False,False,False,True
The Mist,2007.0,1.0,7.1,337000.0,"A freak storm unleashes a species of bloodthirsty creatures on a small town, where a small band of citizens hole up in a supermarket and fight for their lives.",0.0,0.0,1.0,0.0,0.0,0.0,1.0,0.0,1.0,0.0,0.0,False,False,True,False
Captain Fantastic,2016.0,2.0,7.8,233000.0,"In the forests of the Pacific Northwest, a father devoted to raising his six kids with a rigorous physical and intellectual education is forced to leave his paradise and enter the world, challenging his idea of what it means to be a parent.",0.0,0.0,0.0,1.0,1.0,0.0,0.0,0.0,0.0,0.0,0.0,False,False,False,True
Iron Man 2,2010.0,1.0,6.9,863000.0,"With the world now aware of his identity as Iron Man, Tony Stark must contend with both his declining health and a vengeful mad man with ties to his father's legacy.",1.0,0.0,1.0,0.0,0.0,0.0,0.0,0.0,0.0,0.0,0.0,False,True,False,False
Event Horizon,1997.0,2.0,6.6,196000.0,A rescue crew is tasked with investigating the mysterious reappearance of a spaceship that had been lost for seven years.,0.0,0.0,1.0,0.0,0.0,0.0,1.0,0.0,1.0,0.0,0.0,False,False,True,False
E,1982.0,2.0,7.9,435000.0,A troubled child summons the courage to help a friendly alien escape from Earth and return to his home planet.,0.0,1.0,1.0,0.0,0.0,0.0,0.0,0.0,0.0,0.0,0.0,False,True,False,False
Legally Blonde,2001.0,2.0,6.5,245000.0,"Elle Woods, a fashionable sorority queen, is dumped by her boyfriend. She decides to follow him to law school. While she is there, she figures out that there is more to her than just looks.",0.0,0.0,0.0,1.0,0.0,1.0,0.0,0.0,0.0,0.0,0.0,False,True,False,False
Bridesmaids,2011.0,1.0,6.8,308000.0,"Competition between the maid of honor and a bridesmaid, over who is the bride's best friend, threatens to upend the life of an out-of-work pastry chef.",0.0,0.0,0.0,1.0,0.0,0.0,0.0,0.0,0.0,0.0,0.0,False,False,False,True
Robin Hood: Men in Tights,1993.0,2.0,6.7,136000.0,"A spoof of Robin Hood in general, and Robin Hood: Prince of Thieves (1991) in particular.",0.0,1.0,0.0,1.0,0.0,0.0,0.0,0.0,0.0,0.0,0.0,False,True,False,False
The Last Letter from Your Lover,2021.0,2.0,6.7,22000.0,A pair of interwoven stories set in the past and present follow an ambitious journalist determined to solve the mystery of a forbidden love affair at the center of a trove of secret love letters from 1965.,0.0,0.0,0.0,0.0,1.0,1.0,0.0,0.0,0.0,0.0,0.0,False,True,False,False
Reality,2023.0,3.0,6.7,18000.0,A former American intelligence specialist was given the longest sentence for the unauthorized release of government information to the media about Russian interference in the 2016 United States elections via an email operation.,0.0,0.0,0.0,0.0,1.0,0.0,0.0,0.0,0.0,0.0,0.0,False,False,False,True
Cult Killer,2024.0,2.0,4.5,858.0,"When a renowned private investigator is murdered, his protege takes on the case. As her investigation unfolds, she is forced into a dangerous alliance with his killer to uncover the town's grisly secrets and bring justice to its victims.",0.0,1.0,0.0,0.0,1.0,0.0,0.0,0.0,0.0,0.0,1.0,True,False,False,False
Gravity,2013.0,2.0,7.7,859000.0,"Dr Ryan Stone, an engineer on her first time on a space mission, and Matt Kowalski, an astronaut on his final expedition, have to survive in space after they are hit by debris while spacewalking.",0.0,0.0,1.0,0.0,1.0,0.0,1.0,0.0,0.0,0.0,0.0,False,True,False,False
Shame,2011.0,2.0,7.2,205000.0,A sex addict's carefully cultivated private life falls apart after his sister arrives for an indefinite stay.,0.0,0.0,0.0,0.0,1.0,0.0,0.0,0.0,0.0,0.0,0.0,False,False,True,False
Totally Killer,2023.0,2.0,6.5,48000.0,"When the infamous ""Sweet Sixteen Killer"" returns 35 years after his first murder spree to claim another victim, 17-year-old Jamie accidentally travels back in time to 1987, determined to stop the killer before he can start.",0.0,0.0,0.0,1.0,0.0,0.0,0.0,0.0,1.0,0.0,0.0,True,False,False,False
Lucy,2014.0,3.0,6.4,531000.0,"A woman, accidentally caught in a dark deal, turns the tables on her captors and transforms into a merciless warrior evolved beyond human logic.",1.0,0.0,1.0,0.0,0.0,0.0,1.0,0.0,0.0,0.0,0.0,False,False,False,True
Thor,2011.0,2.0,7.0,895000.0,"The powerful but arrogant god Thor is cast out of Asgard to live amongst humans in Midgard (Earth), where he soon becomes one of their finest defenders.",1.0,0.0,0.0,0.0,0.0,0.0,0.0,1.0,0.0,0.0,0.0,False,True,False,False
RRR,2022.0,0.0,7.8,166000.0,A fearless warrior on a perilous mission comes face to face with a steely cop serving British forces in this epic saga set in pre-independent India.,1.0,0.0,0.0,0.0,1.0,0.0,0.0,0.0,0.0,0.0,0.0,False,False,False,True
"McFarland, USA",2015.0,1.0,7.4,42000.0,"Jim White moves his family after losing his last job as a football coach, and at his new school he turns seven disappointing students into one of the best cross-country teams in the region.",0.0,0.0,0.0,0.0,1.0,0.0,0.0,0.0,0.0,0.0,0.0,False,True,False,False
Nightmare Alley,2021.0,0.0,7.0,164000.0,A grifter working his way up from low-ranking carnival worker to lauded psychic medium matches wits with a psychologist bent on exposing him.,0.0,0.0,0.0,0.0,1.0,0.0,1.0,0.0,0.0,0.0,1.0,False,False,False,True
"Are You There God? It's Me, Margaret",2023.0,2.0,7.4,25000.0,"When her family moves from the city to the suburbs, 11-year-old Margaret navigates new friends, feelings, and the beginning of adolescence.",0.0,0.0,0.0,1.0,1.0,0.0,0.0,0.0,0.0,0.0,0.0,False,True,False,False
Sideways,2004.0,1.0,7.5,203000.0,"Two men reaching middle age with not much to show but disappointment embark on a week-long road trip through California's wine country, just as one is about to take a trip down the aisle.",0.0,0.0,0.0,1.0,1.0,1.0,0.0,0.0,0.0,0.0,0.0,True,False,False,False
Stargate,1994.0,2.0,7.0,204000.0,"An interstellar teleportation device, found in Egypt, leads to a planet with humans resembling ancient Egyptians who worship the god Ra.",1.0,1.0,1.0,0.0,0.0,0.0,0.0,0.0,0.0,0.0,0.0,False,True,False,False
Tetris,2023.0,2.0,7.4,81000.0,"The story of how one of the world's most popular video games found its way to players around the globe. Businessman Henk Rogers and Tetris inventor Alexey Pazhitnov join forces in the USSR, risking it all to bring it to the masses.",0.0,0.0,0.0,0.0,1.0,0.0,0.0,0.0,0.0,0.0,0.0,False,False,True,False
Trading Places,1983.0,2.0,7.5,165000.0,A snobbish investor and a wily street con artist find their positions reversed as part of a bet by two callous millionaires.,0.0,0.0,0.0,1.0,0.0,0.0,0.0,0.0,0.0,0.0,0.0,False,True,False,False
Gone with the Wind,1939.0,0.0,8.2,332000.0,A sheltered and manipulative Southern belle and a roguish profiteer face off in a turbulent romance as the society around them crumbles with the end of slavery and is rebuilt during the Civil War and Reconstruction periods.,0.0,0.0,0.0,0.0,1.0,1.0,0.0,0.0,0.0,0.0,0.0,False,True,False,False
This Is Where I Leave You,2014.0,2.0,6.6,89000.0,"After their father passes away, four grown siblings are forced to return to their childhood home and live under the same roof for a week, along with their over-sharing mother and an assortment of spouses, exes, and might-have-beens.",0.0,0.0,0.0,1.0,1.0,0.0,0.0,0.0,0.0,0.0,0.0,False,False,False,True
Triple Frontier,2019.0,1.0,6.5,145000.0,"Loyalties are tested when five friends and former special forces operatives reunite to take down a South American drug lord, unleashing a chain of unintended consequences.",1.0,0.0,0.0,0.0,0.0,0.0,1.0,0.0,0.0,0.0,0.0,False,False,False,True
Alice in Wonderland,2010.0,2.0,6.4,438000.0,"Nineteen-year-old Alice returns to the magical world from her childhood adventure, where she reunites with her old friends and learns of her true destiny: to end the Red Queen's reign of terror.",0.0,1.0,0.0,0.0,0.0,0.0,0.0,1.0,0.0,0.0,0.0,False,True,False,False
Fifty Shades Darker,2017.0,2.0,4.6,111000.0,"While Christian wrestles with his inner demons, Anastasia must confront the anger and envy of the women who came before her.",0.0,0.0,0.0,0.0,1.0,1.0,0.0,0.0,0.0,1.0,0.0,False,False,True,False
Ted 2,2015.0,2.0,6.3,232000.0,"Newlywed couple Ted and Tami-Lynn want to have a baby, but in order to qualify to be a parent, Ted will have to prove he's a person in a court of law.",0.0,0.0,0.0,1.0,0.0,0.0,0.0,0.0,0.0,0.0,0.0,False,False,False,True
"Extremely Wicked, Shockingly Evil and Vile",2019.0,2.0,6.7,102000.0,"A chronicle of the crimes of Ted Bundy from the perspective of Liz, his longtime girlfriend, who refused to believe the truth about him for years.",0.0,0.0,0.0,0.0,1.0,0.0,0.0,0.0,0.0,0.0,1.0,True,False,False,False
Children of Men,2006.0,2.0,7.9,527000.0,"In 2027, in a chaotic world in which women have somehow become infertile, a former activist agrees to help transport a miraculously pregnant woman to a sanctuary at sea.",1.0,0.0,1.0,0.0,1.0,0.0,0.0,0.0,0.0,0.0,0.0,False,False,False,True
Dark Phoenix,2019.0,2.0,5.7,203000.0,"Jean Grey begins to develop incredible powers that corrupt and turn her into a Dark Phoenix, causing the X-Men to decide if her life is worth more than all of humanity.",1.0,1.0,1.0,0.0,0.0,0.0,0.0,0.0,0.0,0.0,0.0,False,True,False,False
Retribution,2023.0,2.0,5.3,18000.0,A bank executive receives a bomb threat while driving his children to school that his car will explode if they stop and get out.,1.0,0.0,0.0,0.0,0.0,0.0,1.0,0.0,0.0,0.0,0.0,True,False,False,False
Mother!,2017.0,1.0,6.6,248000.0,"A couple's relationship is tested when uninvited guests arrive at their home, disrupting their tranquil existence.",0.0,0.0,0.0,0.0,1.0,0.0,0.0,0.0,1.0,1.0,0.0,False,False,True,False
Harry Potter and the Half-Blood Prince,2009.0,0.0,7.6,591000.0,"As Harry Potter begins his sixth year at Hogwarts, he discovers an old book marked as ""the property of the Half-Blood Prince"" and begins to learn more about Lord Voldemort's dark past.",1.0,1.0,0.0,0.0,0.0,0.0,0.0,0.0,0.0,0.0,0.0,False,True,False,False
The Reader,2008.0,1.0,7.6,258000.0,"Post-WWII Germany: Nearly a decade after his affair with an older woman came to a mysterious end, law student Michael Berg re-encounters his former lover as she defends herself in a war-crime trial.",0.0,0.0,0.0,0.0,1.0,1.0,0.0,0.0,0.0,1.0,0.0,False,False,True,False
National Lampoon's Animal House,1978.0,2.0,7.4,129000.0,"At a 1962 college, Dean Vernon Wormer is determined to expel the entire Delta Tau Chi Fraternity, but those troublemakers have other plans for him.",0.0,0.0,0.0,1.0,0.0,0.0,0.0,0.0,0.0,0.0,0.0,True,False,False,False
Hi Nanna,2023.0,0.0,8.2,14000.0,A single father begins to narrate the story of the missing mother to his child and nothing remains the same.,0.0,0.0,0.0,0.0,1.0,1.0,0.0,0.0,0.0,0.0,0.0,False,True,False,False
Girl in the Basement,2021.0,3.0,6.3,13000.0,"Sarah is a teen girl who is looking forward to her 18th birthday to move away from her controlling father Don. But before she could even blow out the candles, Don imprisons her in the basement of their home.",0.0,0.0,0.0,0.0,0.0,0.0,1.0,0.0,0.0,0.0,1.0,True,False,False,False
Mission: Impossible - Ghost Protocol,2011.0,1.0,7.4,526000.0,"The IMF is shut down when it's implicated in the bombing of the Kremlin, causing Ethan Hunt and his new team to go rogue to clear their organization's name.",1.0,1.0,0.0,0.0,0.0,0.0,1.0,0.0,0.0,0.0,0.0,False,False,False,True
"Love, Rosie",2014.0,2.0,7.1,154000.0,"Rosie and Alex have been best friends since they were 5, so they couldn't possibly be right for one another...or could they? When it comes to love, life and making the right choices, these two are their own worst enemies.",0.0,0.0,0.0,1.0,0.0,1.0,0.0,0.0,0.0,0.0,0.0,False,False,False,True
Planet of the Apes,1968.0,2.0,8.0,191000.0,An astronaut crew crash-lands on a planet where highly intelligent non-human ape species are dominant and humans are enslaved.,0.0,1.0,1.0,0.0,0.0,0.0,0.0,0.0,0.0,0.0,0.0,False,True,False,False
Pretty Baby,1978.0,2.0,6.5,13000.0,A preteen girl lives as a prostitute in New Orleans in 1917.,0.0,0.0,0.0,0.0,1.0,0.0,0.0,0.0,0.0,0.0,0.0,False,False,True,False
Pan's Labyrinth,2006.0,2.0,8.2,699000.0,"In the Falangist Spain of 1944, the bookish young stepdaughter of a sadistic army officer escapes into an eerie but captivating fantasy world.",0.0,0.0,0.0,0.0,1.0,0.0,0.0,1.0,0.0,0.0,0.0,False,False,False,True
Batman,1989.0,1.0,7.5,402000.0,"The Dark Knight of Gotham City begins his war on crime with his first major enemy being Jack Napier, a criminal who becomes the clownishly homicidal Joker.",1.0,1.0,0.0,0.0,0.0,0.0,0.0,0.0,0.0,0.0,0.0,False,True,False,False
Mission: Impossible II,2000.0,1.0,6.1,375000.0,"IMF agent Ethan Hunt is sent to Sydney to find and destroy a genetically modified disease called ""Chimera"".",1.0,1.0,0.0,0.0,0.0,0.0,1.0,0.0,0.0,0.0,0.0,False,False,False,True
It Follows,2014.0,2.0,6.8,267000.0,A young woman is followed by an unknown supernatural force after a sexual encounter.,0.0,0.0,0.0,0.0,0.0,0.0,1.0,0.0,1.0,1.0,0.0,False,False,False,True
The Burial,2023.0,1.0,7.1,31000.0,"Inspired by true events, a lawyer helps a funeral home owner save his family business from a corporate behemoth, exposing a complex web of race, power, and injustice.",0.0,0.0,0.0,0.0,1.0,0.0,0.0,0.0,0.0,0.0,0.0,True,False,False,False
Aladdin,1992.0,2.0,8.0,462000.0,A kind-hearted street urchin and a power-hungry Grand Vizier vie for a magic lamp that has the power to make their deepest wishes come true.,0.0,1.0,0.0,1.0,0.0,0.0,0.0,0.0,0.0,0.0,0.0,False,True,False,False
Pirates of the Caribbean: Dead Man's Chest,2006.0,0.0,7.4,762000.0,"Jack Sparrow races to recover the heart of Davy Jones to avoid enslaving his soul to Jones' service, as other friends and foes seek the heart for their own agenda as well.",1.0,1.0,0.0,0.0,0.0,0.0,0.0,1.0,0.0,0.0,0.0,False,True,False,False
You Hurt My Feelings,2023.0,2.0,6.6,11000.0,A novelist's longstanding marriage is suddenly upended when she overhears her husband giving his honest reaction to her latest book.,0.0,0.0,0.0,1.0,1.0,0.0,0.0,0.0,0.0,0.0,0.0,False,True,False,False
Final Fantasy VII: Advent Children,2005.0,2.0,7.2,58000.0,An ex-mercenary is forced out of isolation when three mysterious men kidnap and brainwash the city's children afflicted with the Geostigma disease.,1.0,1.0,0.0,0.0,0.0,0.0,0.0,0.0,0.0,0.0,0.0,False,True,False,False
Downfall,2004.0,0.0,8.2,373000.0,"Traudl Junge, the final secretary for Adolf Hitler, tells of the Nazi dictator's final days in his Berlin bunker at the end of WWII.",0.0,0.0,0.0,0.0,1.0,0.0,0.0,0.0,0.0,0.0,0.0,False,False,False,True
American Hustle,2013.0,1.0,7.2,499000.0,"A con man, Irving Rosenfeld, along with his seductive partner Sydney Prosser, is forced to work for a wild F.B.I. Agent, Richie DiMaso, who pushes them into a world of Jersey powerbrokers and the Mafia.",0.0,0.0,0.0,0.0,1.0,0.0,0.0,0.0,0.0,0.0,1.0,False,False,False,True
Insomnia,2002.0,2.0,7.2,316000.0,Two Los Angeles homicide detectives are dispatched to a northern town where the sun doesn't set to investigate the methodical murder of a local teen.,0.0,0.0,0.0,0.0,1.0,0.0,1.0,0.0,0.0,1.0,0.0,False,False,False,True
"Red, White & Royal Blue",2023.0,2.0,7.0,46000.0,"When the feud between the son of the American President and Britain's prince threatens to drive a wedge in U.S./British relations, the two are forced into a staged truce that sparks something deeper.",0.0,0.0,0.0,1.0,0.0,1.0,0.0,0.0,0.0,0.0,0.0,True,False,False,False
Batman & Robin,1997.0,1.0,3.8,267000.0,Batman and Robin try to keep their relationship together even as they must stop Mr. Freeze and Poison Ivy from freezing Gotham City.,1.0,0.0,1.0,0.0,0.0,0.0,0.0,0.0,0.0,0.0,0.0,False,True,False,False
The Silencing,2020.0,2.0,6.3,34000.0,A reformed hunter living in isolation on a wildlife sanctuary becomes involved in a deadly game of cat and mouse when he and the local Sheriff set out to track a vicious killer who may have kidnapped his daughter years ago.,1.0,0.0,0.0,0.0,0.0,0.0,0.0,0.0,0.0,1.0,1.0,False,False,False,True
