title,released_year,run_time,stars,total_ratings,summary,Action,Adventure,Sci-Fi,Comedy,Drama,Romance,Thriller,Fantasy,Horror,Mystery,Crime,Adults,Kids,Other,Teens
Strangers on a Train,1951.0,2.0,7.9,140000.0,A psychopathic man tries to forcibly persuade a tennis star to agree to his theory that two strangers can get away with murder by submitting to his plan to kill the other's most-hated person.,0.0,0.0,0.0,0.0,1.0,0.0,0.0,0.0,0.0,0.0,1.0,False,True,False,False
Beethoven,1992.0,3.0,5.7,76000.0,"A slobbering St. Bernard becomes the center of attention for a loving family, but must contend with a dog-napping veterinarian and his henchmen.",0.0,0.0,0.0,1.0,1.0,0.0,0.0,0.0,0.0,0.0,0.0,False,True,False,False
Men in Black II,2002.0,3.0,6.2,401000.0,Agent J is sent to find Agent K and restore his memory after the re-appearance of a case from K's past.,1.0,1.0,0.0,1.0,0.0,0.0,0.0,0.0,0.0,0.0,0.0,False,True,False,False
Machete,2010.0,2.0,6.6,204000.0,"After being set-up and betrayed by the man who hired him to assassinate a Texas Senator, an ex-Federale launches a brutal rampage of revenge against his former boss.",1.0,0.0,0.0,0.0,0.0,0.0,1.0,0.0,0.0,0.0,1.0,False,False,True,False
As Good as It Gets,1997.0,1.0,7.7,317000.0,"A single mother and waitress, a misanthropic author, and a gay artist form an unlikely friendship after the artist is assaulted in a robbery.",0.0,0.0,0.0,1.0,1.0,1.0,0.0,0.0,0.0,0.0,0.0,False,True,False,False
Flight,2012.0,1.0,7.3,374000.0,Troubling questions arise after airline pilot Whip Whitaker makes a miracle landing after a mid-air catastrophe.,0.0,0.0,0.0,0.0,1.0,0.0,1.0,0.0,0.0,0.0,0.0,False,False,True,False
PAW Patrol: The Mighty Movie,2023.0,3.0,6.0,4600.0,"A magical meteor crash lands in Adventure City and gives the PAW Patrol pups superpowers, transforming them into The Mighty Pups",1.0,1.0,0.0,0.0,0.0,0.0,0.0,0.0,0.0,0.0,0.0,False,True,False,False
Guillermo del Toro's Pinocchio,2022.0,2.0,7.6,111000.0,"A father's wish magically brings a wooden boy to life in Italy, giving him a chance to care for the child.",0.0,1.0,0.0,1.0,0.0,0.0,0.0,0.0,0.0,0.0,0.0,False,True,False,False
Redemption,2013.0,2.0,6.2,77000.0,A damaged ex-special forces soldier navigating London's criminal underworld seizes an opportunity to assume another man's identity.,1.0,0.0,0.0,0.0,1.0,0.0,0.0,0.0,0.0,0.0,1.0,False,False,False,True
Get Smart,2008.0,2.0,6.5,228000.0,"Maxwell Smart, a highly intellectual but bumbling spy working for the CONTROL agency, is tasked with preventing a terrorist attack from rival spy agency KAOS.",1.0,1.0,0.0,1.0,0.0,0.0,0.0,0.0,0.0,0.0,0.0,False,True,False,False
Silent Night,2021.0,2.0,5.7,20000.0,"Nell, Simon, and their 3 sons are ready to welcome friends and family for what promises to be a perfect Christmas gathering. Perfect except for one thing: everyone is going to die.",0.0,0.0,0.0,1.0,1.0,0.0,0.0,0.0,0.0,0.0,0.0,False,False,True,False
How to Train Your Dragon: The Hidden World,2019.0,2.0,7.4,149000.0,"When Hiccup discovers Toothless isn't the only Night Fury, he must seek the Hidden World, a secret Dragon Utopia before a hired tyrant named Grimmel finds it first.",1.0,1.0,0.0,0.0,0.0,0.0,0.0,0.0,0.0,0.0,0.0,False,True,False,False
Fatal Attraction,1987.0,2.0,6.9,96000.0,A married man's one-night stand comes back to haunt him when that lover begins to stalk him and his family.,0.0,0.0,0.0,0.0,1.0,0.0,1.0,0.0,0.0,0.0,0.0,False,False,True,False
The Contractor,2022.0,2.0,5.8,28000.0,"A discharged U.S. Special Forces sergeant, James Harper, risks everything for his family when he joins a private contracting organization.",1.0,0.0,0.0,0.0,1.0,0.0,1.0,0.0,0.0,0.0,0.0,False,False,False,True
Occupied City,2023.0,0.0,6.6,346.0,"The past collides with the present in this excavation of the Nazi occupation of Amsterdam: a journey from World War II to recent years of pandemic and protest and a provocative, life-affirming reflection on memory, time and what's to come.",0.0,0.0,0.0,0.0,0.0,0.0,0.0,0.0,0.0,0.0,0.0,False,False,False,True
Lamb,2021.0,2.0,6.3,38000.0,A childless couple discovers a mysterious newborn on their farm in Iceland.,0.0,0.0,0.0,0.0,1.0,0.0,0.0,1.0,1.0,0.0,0.0,False,False,False,True
"Blood In, Blood Out",1993.0,0.0,7.9,34000.0,"Based on the true life experiences of poet Jimmy Santiago Baca, the film focuses on step-brothers Paco and Cruz, and their bi-racial cousin Miklo.",0.0,0.0,0.0,0.0,1.0,0.0,0.0,0.0,0.0,0.0,1.0,False,False,False,True
No Reservations,2007.0,2.0,6.3,78000.0,The life of a top chef changes when she becomes the guardian of her young niece.,0.0,0.0,0.0,1.0,1.0,1.0,0.0,0.0,0.0,0.0,0.0,False,True,False,False
The Blair Witch Project,1999.0,3.0,6.5,283000.0,"Three film students vanish after traveling into a Maryland forest to film a documentary on the local Blair Witch legend, leaving only their footage behind.",0.0,0.0,0.0,0.0,0.0,0.0,0.0,0.0,1.0,1.0,0.0,False,False,False,True
The Autopsy of Jane Doe,2016.0,3.0,6.8,137000.0,"A father and son, both coroners, are pulled into a complex mystery while attempting to identify the cause of death of a young woman who was apparently harboring dark secrets.",0.0,0.0,0.0,0.0,0.0,0.0,1.0,0.0,1.0,1.0,0.0,False,False,False,True
Green Room,2015.0,2.0,7.0,138000.0,A punk rock band is forced to fight for survival after witnessing a murder at a neo-Nazi skinhead bar.,0.0,0.0,0.0,0.0,1.0,0.0,0.0,0.0,1.0,0.0,1.0,False,False,False,True
Alien: Resurrection,1997.0,2.0,6.2,262000.0,"Two centuries after her death, a powerful human/alien hybrid clone of Ellen Ripley aids a crew of space pirates in stopping the aliens from reaching Earth.",1.0,0.0,1.0,0.0,0.0,0.0,0.0,0.0,1.0,0.0,0.0,True,False,False,False
Die Another Day,2002.0,1.0,6.1,228000.0,"James Bond is sent to investigate the connection between a North Korean terrorist and a diamond mogul, who is funding the development of an international space weapon.",1.0,1.0,0.0,0.0,0.0,0.0,1.0,0.0,0.0,0.0,0.0,False,False,False,True
Ghostbusters,2016.0,2.0,6.8,243000.0,"Following a ghost invasion of Manhattan, paranormal enthusiasts Erin Gilbert and Abby Yates, nuclear engineer Jillian Holtzmann, and subway worker Patty Tolan band together to stop the otherworldly threat.",1.0,0.0,0.0,1.0,0.0,0.0,0.0,1.0,0.0,0.0,0.0,False,True,False,False
Squealer,2023.0,2.0,3.4,424.0,"When a local cop and an overzealous social-worker follow clues on missing persons cases around town, stomach-turning discoveries are unearthed on a pig farm, where the town butcher has been slaughtering more than livestock.",1.0,0.0,0.0,0.0,0.0,0.0,1.0,0.0,1.0,0.0,0.0,True,False,False,False
Death Becomes Her,1992.0,2.0,6.6,130000.0,"When a fading actress learns of an immortality treatment, she sees it as a way to outdo her long-time rival.",0.0,0.0,0.0,1.0,0.0,0.0,0.0,1.0,1.0,0.0,0.0,False,False,False,True
Minions: The Rise of Gru,2022.0,3.0,6.5,84000.0,The untold story of one twelve-year-old's dream to become the world's greatest supervillain.,0.0,1.0,0.0,1.0,0.0,0.0,0.0,0.0,0.0,0.0,0.0,False,True,False,False
Fear,1996.0,2.0,6.2,53000.0,"When Nicole met David; handsome, charming, affectionate, he was everything. It seemed perfect, but soon she sees that David has a darker side. And his adoration turns to obsession, their dream into a nightmare, and her love into fear.",0.0,0.0,0.0,0.0,1.0,0.0,1.0,0.0,0.0,0.0,0.0,False,False,True,False
Lara Croft: Tomb Raider,2001.0,2.0,5.8,218000.0,Video game adventurer Lara Croft comes to life in a movie where she races against time and villains to recover powerful ancient artifacts.,1.0,1.0,0.0,0.0,0.0,0.0,0.0,1.0,0.0,0.0,0.0,False,True,False,False
Alone,2020.0,2.0,6.2,27000.0,"A recently widowed traveler is kidnapped by a cold blooded killer, only to escape into the wilderness where she is forced to battle against the elements as her pursuer closes in on her.",0.0,0.0,0.0,0.0,1.0,0.0,0.0,0.0,1.0,1.0,0.0,True,False,False,False
Wrong Turn,2021.0,2.0,5.5,36000.0,"Friends hiking the Appalachian Trail are confronted by 'The Foundation', a community of people who have lived in the mountains for hundreds of years.",0.0,0.0,0.0,0.0,0.0,0.0,1.0,0.0,1.0,0.0,0.0,False,False,False,True
M*A*S*H,1970.0,2.0,7.4,77000.0,The staff of a Korean War field hospital use humor and high jinks to keep their sanity in the face of the horror of war.,0.0,0.0,0.0,1.0,1.0,0.0,0.0,0.0,0.0,0.0,0.0,False,False,True,False
Die Hard with a Vengeance,1995.0,1.0,7.6,406000.0,"John McClane and a Harlem store owner are targeted by German terrorist Simon in New York City, where he plans to rob the Federal Reserve Building.",1.0,1.0,0.0,0.0,0.0,0.0,1.0,0.0,0.0,0.0,0.0,False,False,False,True
Cabin Fever,2002.0,2.0,5.6,83000.0,"Five college graduates rent a cabin in the woods and begin to fall victim to a horrifying flesh-eating virus, which attracts the unwanted attention of the homicidal locals.",0.0,0.0,0.0,0.0,0.0,0.0,0.0,0.0,1.0,0.0,0.0,False,False,True,False
They Live,1988.0,2.0,7.2,144000.0,They influence our decisions without us knowing it. They numb our senses without us feeling it. They control our lives without us realizing it. They live.,1.0,0.0,1.0,0.0,0.0,0.0,0.0,0.0,1.0,0.0,0.0,False,False,False,True
Dracula Untold,2014.0,2.0,6.2,207000.0,"As his kingdom is being threatened by the Turks, young prince Vlad Tepes must become a monster feared by his own people in order to obtain the power needed to protect his own family, and the families of his kingdom.",1.0,0.0,0.0,0.0,1.0,0.0,0.0,1.0,0.0,0.0,0.0,False,False,False,True
Melancholia,2011.0,1.0,7.1,195000.0,Two sisters find their already strained relationship challenged as a mysterious new planet threatens to collide with Earth.,0.0,0.0,1.0,0.0,1.0,0.0,0.0,0.0,0.0,0.0,0.0,False,False,False,True
Deep Rising,1998.0,2.0,6.1,41000.0,"A group of heavily armed hijackers board a luxury ocean liner in the South Pacific Ocean to loot it, only to do battle with a series of large-sized, tentacled, man-eating sea creatures who had already invaded the ship.",1.0,1.0,0.0,0.0,0.0,0.0,0.0,0.0,1.0,0.0,0.0,False,True,False,False
Ant-Man,2015.0,2.0,7.2,717000.0,"Armed with a super-suit with the astonishing ability to shrink in scale but increase in strength, cat burglar Scott Lang must embrace his inner hero and help his mentor, Dr. Hank Pym, pull off a plan that will save the world.",1.0,0.0,1.0,1.0,0.0,0.0,0.0,0.0,0.0,0.0,0.0,False,True,False,False
Breaking Away,1979.0,2.0,7.7,25000.0,A working-class Indiana teen obsessed with the Italian cycling team vies for the affections of a college girl while searching for life goals with his friends.,0.0,0.0,0.0,1.0,1.0,0.0,0.0,0.0,0.0,0.0,0.0,False,True,False,False
We Need to Talk About Kevin,2011.0,2.0,7.5,167000.0,"Kevin's mother struggles to love her strange child despite the increasingly dangerous things he says and does as he grows up. But Kevin is just getting started, and his final act will be beyond anything anyone imagined.",0.0,0.0,0.0,0.0,1.0,0.0,1.0,0.0,0.0,1.0,0.0,False,False,False,True
The Red Shoes,1948.0,1.0,8.1,39000.0,A young ballet dancer is torn between the man she loves and her pursuit to become a prima ballerina.,0.0,0.0,0.0,0.0,1.0,1.0,0.0,0.0,0.0,0.0,0.0,False,False,True,False
Set It Up,2018.0,2.0,6.5,63000.0,Two corporate executive assistants hatch a plan to match-make their two bosses.,0.0,0.0,0.0,1.0,0.0,1.0,0.0,0.0,0.0,0.0,0.0,True,False,False,False
The Void,2016.0,2.0,5.9,41000.0,"Shortly after delivering a patient to an understaffed hospital, a police officer experiences strange and violent occurrences seemingly linked to a group of mysterious hooded figures.",0.0,0.0,1.0,0.0,0.0,0.0,0.0,0.0,1.0,1.0,0.0,False,False,True,False
The Mighty Ducks,1992.0,2.0,6.6,71000.0,A self-centered Minnesota lawyer is sentenced to community service coaching a rag tag youth hockey team.,0.0,0.0,0.0,1.0,1.0,0.0,0.0,0.0,0.0,0.0,0.0,False,True,False,False
The Dictator,2012.0,3.0,6.4,332000.0,The heroic story of a dictator who risked his life to ensure that democracy would never come to the country he so lovingly oppressed.,0.0,0.0,0.0,1.0,0.0,0.0,0.0,0.0,0.0,0.0,0.0,False,False,False,True
Seven Psychopaths,2012.0,2.0,7.1,273000.0,A struggling screenwriter inadvertently becomes entangled in the Los Angeles criminal underworld after his oddball friends kidnap a gangster's beloved Shih Tzu.,0.0,0.0,0.0,1.0,0.0,0.0,0.0,0.0,0.0,0.0,1.0,False,False,True,False
Family Switch,2023.0,2.0,5.6,25000.0,"When a chance encounter with an astrological reader causes the Walkers to wake up to a full body switch, can they unite to land a promotion, college interview, record deal, and soccer tryout?",0.0,0.0,0.0,1.0,0.0,0.0,0.0,0.0,0.0,0.0,0.0,False,True,False,False
Jupiter Ascending,2015.0,1.0,5.3,194000.0,A young woman discovers her destiny as an heiress of intergalactic nobility and must fight to protect the inhabitants of Earth from an ancient and destructive industry.,1.0,1.0,1.0,0.0,0.0,0.0,0.0,0.0,0.0,0.0,0.0,False,True,False,False
Marie Antoinette,2006.0,1.0,6.5,121000.0,"The retelling of France's iconic but ill-fated queen, Marie Antoinette. From her betrothal and marriage to Louis XVI at 14 to her reign as queen at 19 and to the end of her reign as queen, and ultimately the fall of Versailles.",0.0,0.0,0.0,0.0,1.0,0.0,0.0,0.0,0.0,0.0,0.0,False,True,False,False
Enter the Void,2009.0,0.0,7.2,87000.0,"An American drug dealer living in Tokyo is betrayed by his best friend and killed in a drug deal. His soul, observing the repercussions of his death, seeks resurrection.",0.0,0.0,0.0,0.0,1.0,0.0,0.0,1.0,0.0,0.0,0.0,True,False,False,False
300: Rise of an Empire,2014.0,2.0,6.2,315000.0,"Greek general Themistocles of Athens leads the naval charge against invading Persian forces led by mortal-turned-god Xerxes and Artemisia, vengeful commander of the Persian navy.",1.0,0.0,0.0,0.0,1.0,0.0,0.0,0.0,0.0,0.0,0.0,False,False,True,False
Moonstruck,1987.0,2.0,7.2,67000.0,"Loretta Castorini, a bookkeeper from Brooklyn, New York, finds herself in a difficult situation when she falls for the brother of the man she has agreed to marry.",0.0,0.0,0.0,1.0,1.0,1.0,0.0,0.0,0.0,0.0,0.0,False,True,False,False
Save the Green Planet!,2003.0,2.0,7.2,8700.0,"Byeong-gu believes that the world is on the verge of an alien invasion, and sets out to save the world.",0.0,0.0,0.0,1.0,1.0,0.0,0.0,0.0,0.0,0.0,1.0,False,False,True,False
Goldfinger,1964.0,2.0,7.7,201000.0,"While investigating a gold magnate's smuggling, James Bond uncovers a plot to contaminate the Fort Knox gold reserve.",1.0,1.0,0.0,0.0,0.0,0.0,1.0,0.0,0.0,0.0,0.0,False,False,False,True
Pet Sematary: Bloodlines,2023.0,3.0,4.6,10000.0,In 1969 a young Jud Crandall and his childhood friends band together to confront an ancient evil that has gripped their hometown of Ludlow.,0.0,0.0,0.0,0.0,0.0,0.0,0.0,1.0,1.0,0.0,0.0,False,False,False,True
Palmer,2021.0,2.0,7.3,43000.0,An ex-convict strikes up a friendship with a boy from a troubled home.,0.0,0.0,0.0,0.0,1.0,0.0,0.0,0.0,0.0,0.0,0.0,False,False,False,True
"The Gangster, the Cop, the Devil",2019.0,2.0,6.9,22000.0,A crime boss teams up with a cop to track down a serial killer.,1.0,0.0,0.0,0.0,0.0,0.0,1.0,0.0,0.0,0.0,1.0,False,False,False,True
Super 8,2011.0,2.0,7.0,366000.0,"During the summer of 1979, a group of friends witness a train crash and investigate subsequent unexplained events in their small town.",1.0,0.0,1.0,0.0,0.0,0.0,0.0,0.0,0.0,1.0,0.0,False,True,False,False
Straight Outta Compton,2015.0,1.0,7.8,217000.0,"The rap group NWA emerges from the mean streets of Compton in Los Angeles, California, in the mid-1980s and revolutionizes Hip Hop culture with their music and tales about life in the hood.",0.0,0.0,0.0,0.0,1.0,0.0,0.0,0.0,0.0,0.0,0.0,False,False,False,True
Sin City: A Dame to Kill For,2014.0,2.0,6.5,170000.0,Some of Sin City's most hard-boiled citizens cross paths with a few of its more reviled inhabitants.,1.0,0.0,0.0,0.0,0.0,0.0,1.0,0.0,0.0,0.0,1.0,False,False,True,False
Luther: The Fallen Sun,2023.0,1.0,6.4,63000.0,Brilliant but disgraced detective John Luther breaks out of prison to hunt down a sadistic serial killer who is terrorising London.,0.0,0.0,0.0,0.0,1.0,0.0,0.0,0.0,0.0,1.0,1.0,False,False,False,True
The Pod Generation,2023.0,2.0,5.6,3300.0,"In a not-so-distant future, tech giant Pegazus offers couples the opportunity to share their pregnancies via detachable artificial wombs or pods. And so begins Rachel and Alvy's wild ride to parenthood in this brave new world.",0.0,0.0,1.0,1.0,0.0,1.0,0.0,0.0,0.0,0.0,0.0,False,False,False,True
Master Gardener,2022.0,2.0,6.2,8900.0,"A meticulous horticulturist is devoted to tending the grounds of a beautiful estate and pandering to his employer, the wealthy dowager.",0.0,0.0,0.0,0.0,1.0,0.0,1.0,0.0,0.0,1.0,0.0,False,False,False,True
Dark Shadows,2012.0,2.0,6.2,279000.0,"An imprisoned vampire, Barnabas Collins, is set free and returns to his ancestral home, where his dysfunctional descendants are in need of his protection.",0.0,0.0,0.0,1.0,0.0,0.0,0.0,1.0,1.0,0.0,0.0,False,False,False,True
Grindhouse,2007.0,0.0,7.5,191000.0,Quentin Tarantino and Robert Rodriguez's homage to exploitation double features in the '60s and '70s with two back-to-back cult films that include previews of coming attractions between them.,1.0,0.0,0.0,0.0,0.0,0.0,1.0,0.0,1.0,0.0,0.0,False,False,True,False
Coherence,2013.0,3.0,7.2,144000.0,Strange things begin to happen when a group of friends gather for a dinner party on an evening when a comet is passing overhead.,0.0,0.0,1.0,0.0,1.0,0.0,0.0,0.0,0.0,1.0,0.0,False,False,False,True
Coming to America,1988.0,2.0,7.1,222000.0,"An extremely pampered African prince travels to Queens, New York and goes undercover to find a wife that he can respect for her intelligence and strong will.",0.0,0.0,0.0,1.0,0.0,1.0,0.0,0.0,0.0,0.0,0.0,False,False,False,True
Duplex,2003.0,3.0,5.9,61000.0,"A young couple has a chance to move into a gorgeous duplex in the perfect New York neighborhood. All they have to do is bump off the current tenant, a cute little old lady.",0.0,0.0,0.0,1.0,0.0,0.0,0.0,0.0,0.0,0.0,0.0,False,True,False,False
"As Above, So Below",2014.0,2.0,6.2,110000.0,"When a team of explorers venture into the catacombs that lie beneath the streets of Paris, they uncover the dark secret that lies within this city of the dead.",0.0,0.0,0.0,0.0,0.0,0.0,1.0,0.0,1.0,1.0,0.0,False,False,False,True
Silence,2016.0,0.0,7.2,122000.0,"In the 17th century, two Portuguese Jesuit priests travel to Japan in an attempt to locate their mentor, who is rumored to have committed apostasy, and to propagate Catholicism.",0.0,0.0,0.0,0.0,1.0,0.0,0.0,0.0,0.0,0.0,0.0,False,False,False,True
The Master,2012.0,1.0,7.1,185000.0,A Naval veteran arrives home from war unsettled and uncertain of his future - until he is tantalized by the Cause and its charismatic leader.,0.0,0.0,0.0,0.0,1.0,0.0,0.0,0.0,0.0,0.0,0.0,False,False,False,True
La haine,1995.0,2.0,8.1,194000.0,24 hours in the lives of three young men in the French suburbs the day after a violent riot.,0.0,0.0,0.0,0.0,1.0,0.0,0.0,0.0,0.0,0.0,1.0,True,False,False,False
American Graffiti,1973.0,2.0,7.4,98000.0,A group of teenagers in California's central valley spend one final night after their 1962 high school graduation cruising the strip with their buddies before they pursue their varying goals.,0.0,0.0,0.0,1.0,1.0,0.0,0.0,0.0,0.0,0.0,0.0,False,True,False,False
The Theory of Everything,2014.0,1.0,7.7,479000.0,Stephen Hawking gets unprecedented success in the field of physics despite being diagnosed with motor neuron disease at the age of 21. He defeats awful odds as his first wife Jane aids him loyally.,0.0,0.0,0.0,0.0,1.0,1.0,0.0,0.0,0.0,0.0,0.0,False,True,False,False
Official Secrets,2019.0,2.0,7.3,54000.0,The true story of a British whistleblower who leaked information to the press about an illegal NSA spy operation designed to push the UN Security Council into sanctioning the 2003 invasion of Iraq.,0.0,0.0,0.0,0.0,1.0,0.0,0.0,0.0,0.0,0.0,1.0,False,False,False,True
Crimes of the Future,2022.0,2.0,5.8,40000.0,"Humans adapt to a synthetic environment, with new transformations and mutations. With his partner Caprice, Saul Tenser, celebrity performance artist, publicly showcases the metamorphosis of his organs in avant-garde performances.",0.0,0.0,1.0,0.0,1.0,0.0,0.0,0.0,1.0,0.0,0.0,False,False,True,False
Heartbreakers,2001.0,1.0,6.2,58000.0,A mother and daughter con team seduce and scam wealthy men.,0.0,0.0,0.0,1.0,0.0,1.0,0.0,0.0,0.0,0.0,1.0,False,False,False,True
1984,1984.0,2.0,7.1,78000.0,"In a totalitarian future society, a man, whose daily work is re-writing history, tries to rebel by falling in love.",0.0,0.0,1.0,0.0,1.0,0.0,0.0,0.0,0.0,0.0,0.0,True,False,False,False
The Road Warrior,1981.0,2.0,7.6,192000.0,"In the post-apocalyptic Australian wasteland, a cynical drifter agrees to help a small, gasoline-rich community escape a horde of bandits.",1.0,1.0,1.0,0.0,0.0,0.0,0.0,0.0,0.0,0.0,0.0,True,False,False,False
Love Story,1970.0,2.0,6.9,37000.0,A boy and a girl from different backgrounds fall in love regardless of their upbringing - and then tragedy strikes.,0.0,0.0,0.0,0.0,1.0,1.0,0.0,0.0,0.0,0.0,0.0,False,False,False,True
Career Opportunities,1991.0,3.0,5.8,17000.0,Jim is the dorky son of a local cement contractor who lives at home and has no direction. Josie is the gorgeous daughter of a wealthy businessman who dreams of leaving town. They find they have a lot in common.,0.0,0.0,0.0,1.0,0.0,1.0,0.0,0.0,0.0,0.0,0.0,False,True,False,False
Three Thousand Years of Longing,2022.0,2.0,6.7,59000.0,"A lonely scholar, on a trip to Istanbul, discovers a Djinn who offers her three wishes in exchange for his freedom.",0.0,0.0,0.0,0.0,1.0,1.0,0.0,1.0,0.0,0.0,0.0,False,False,False,True
I Care a Lot,2020.0,2.0,6.4,145000.0,A crooked legal guardian who drains the savings of her elderly wards meets her match when a woman she tries to swindle turns out to be more than she first appears.,0.0,0.0,0.0,1.0,1.0,0.0,0.0,0.0,0.0,0.0,1.0,True,False,False,False
Footloose,2011.0,2.0,5.8,53000.0,"City teenager Ren MacCormack moves to a small town where rock music and dancing have been banned, and his rebellious spirit shakes up the populace.",0.0,0.0,0.0,1.0,1.0,0.0,0.0,0.0,0.0,0.0,0.0,False,True,False,False
The Texas Chain Saw Massacre,1974.0,3.0,7.4,182000.0,"Five friends head out to rural Texas to visit the grave of a grandfather. On the way they stumble across what appears to be a deserted house, only to discover something sinister within. Something armed with a chainsaw.",0.0,0.0,0.0,0.0,0.0,0.0,0.0,0.0,1.0,0.0,0.0,False,False,True,False
Don't Breathe,2016.0,3.0,7.1,298000.0,"Hoping to walk away with a massive fortune, a trio of thieves break into the house of a blind man who isn't as helpless as he seems.",0.0,0.0,0.0,0.0,0.0,0.0,1.0,0.0,1.0,0.0,1.0,False,False,False,True
Gremlins,1984.0,2.0,7.3,246000.0,A young man inadvertently breaks three important rules concerning his new pet and unleashes a horde of malevolently mischievous monsters on a small town.,0.0,0.0,0.0,1.0,0.0,0.0,0.0,1.0,1.0,0.0,0.0,False,False,False,True
Brawl in Cell Block 99,2017.0,1.0,7.1,75000.0,A former boxer-turned-drug runner lands in a prison battleground after a deal gets deadly.,1.0,0.0,0.0,0.0,1.0,0.0,0.0,0.0,0.0,0.0,1.0,False,False,True,False
Lie with Me,2005.0,2.0,5.2,17000.0,"An outgoing, sexually aggressive young woman meets and begins a torrid affair with an equally aggressive young man in which their affair begins to bring a strain on their personal lives.",0.0,0.0,0.0,0.0,1.0,1.0,0.0,0.0,0.0,0.0,0.0,True,False,False,False
Blades of Glory,2007.0,2.0,6.3,177000.0,"In 2002, two rival Olympic ice skaters were stripped of their gold medals and permanently banned from men's single competition. Presently, however, they've found a loophole that will allow them to qualify as a pairs team.",0.0,0.0,0.0,1.0,0.0,0.0,0.0,0.0,0.0,0.0,0.0,False,True,False,False
The Wanderers,1979.0,2.0,7.3,12000.0,"The Wanderers is a teenage, Italian gang in Bronx, NYC, 1963. They have their confrontations with other gangs. Drugs and weapons are uncool. Adult life awaits them.",0.0,0.0,0.0,0.0,1.0,1.0,0.0,0.0,0.0,0.0,1.0,False,True,False,False
The Mask of Zorro,1998.0,1.0,6.8,197000.0,"A young thief seeking revenge for his brother's death is trained by the once-great, aging Zorro, who is pursuing his own vengeance.",1.0,1.0,0.0,1.0,0.0,0.0,0.0,0.0,0.0,0.0,0.0,False,True,False,False
The Nun,2018.0,2.0,5.3,169000.0,A priest with a haunted past and a novice on the threshold of her final vows are sent by the Vatican to investigate the death of a young nun in Romania and confront a malevolent force in the form of a demonic nun.,0.0,0.0,0.0,0.0,0.0,0.0,1.0,0.0,1.0,1.0,0.0,False,False,False,True
Passages,2023.0,2.0,6.7,10000.0,A gay couple's marriage is thrown into crisis when one of them impulsively begins a passionate affair with a young woman.,0.0,0.0,0.0,0.0,1.0,1.0,0.0,0.0,0.0,0.0,0.0,False,False,True,False
The Choice,2016.0,2.0,6.5,45000.0,Travis and Gabby first meet as neighbors in a small coastal town and wind up in a relationship that is tested by life's most defining events.,0.0,0.0,0.0,0.0,1.0,1.0,0.0,0.0,0.0,0.0,0.0,False,True,False,False
Austin Powers: International Man of Mystery,1997.0,2.0,7.0,256000.0,A world-class playboy and part-time secret agent from the 1960s emerges after thirty years in a cryogenic state to battle with his nemesis Dr. Evil.,0.0,1.0,0.0,1.0,0.0,0.0,0.0,0.0,0.0,0.0,0.0,False,False,False,True
Angel Has Fallen,2019.0,1.0,6.4,109000.0,Mike Banning is framed for the attempted assassination of the President and must evade his own agency and the FBI as he tries to uncover the real threat.,1.0,0.0,0.0,0.0,0.0,0.0,1.0,0.0,0.0,0.0,0.0,False,False,False,True
