title,released_year,run_time,stars,total_ratings,summary,Action,Adventure,Sci-Fi,Comedy,Drama,Romance,Thriller,Fantasy,Horror,Mystery,Crime,Adults,Kids,Other,Teens
Madame Web,2024.0,2.0,3.8,28000.0,"Cassandra Webb is a New York metropolis paramedic who begins to demonstrate signs of clairvoyance. Forced to challenge revelations about her past, she needs to safeguard three young women from a deadly adversary who wants them destroyed.",1.0,1.0,1.0,0.0,0.0,0.0,0.0,0.0,0.0,0.0,0.0,False,True,False,False
Oppenheimer,2023.0,0.0,8.4,654000.0,The story of American scientist J. Robert Oppenheimer and his role in the development of the atomic bomb.,0.0,0.0,0.0,0.0,1.0,0.0,0.0,0.0,0.0,0.0,0.0,False,False,False,True
Dune: Part Two,2024.0,0.0,9.1,28000.0,Paul Atreides unites with Chani and the Fremen while seeking revenge against the conspirators who destroyed his family.,1.0,1.0,0.0,0.0,1.0,0.0,0.0,0.0,0.0,0.0,0.0,False,True,False,False
Poor Things,2023.0,1.0,8.3,115000.0,"The incredible tale about the fantastical evolution of Bella Baxter, a young woman brought back to life by the brilliant and unorthodox scientist Dr. Godwin Baxter.",0.0,0.0,0.0,1.0,1.0,1.0,0.0,0.0,0.0,0.0,0.0,False,False,True,False
Anyone But You,2023.0,2.0,6.3,41000.0,"After an amazing first date, Bea and Ben's fiery attraction turns ice-cold--until they find themselves unexpectedly reunited at a lesbian wedding in Australia. So they do what any two mature adults would do: pretend to be a couple.",0.0,0.0,0.0,1.0,0.0,1.0,0.0,0.0,0.0,0.0,0.0,False,False,False,True
The Zone of Interest,2023.0,2.0,7.6,36000.0,Auschwitz commandant Rudolf Höss and his wife Hedwig strive to build a dream life for their family in a house and garden beside the camp.,0.0,0.0,0.0,0.0,1.0,0.0,0.0,0.0,0.0,0.0,0.0,False,True,False,False
Dune,2021.0,0.0,8.0,773000.0,A noble family becomes embroiled in a war for control over the galaxy's most valuable asset while its heir becomes troubled by visions of a dark future.,1.0,1.0,0.0,0.0,1.0,0.0,0.0,0.0,0.0,0.0,0.0,False,True,False,False
Bob Marley: One Love,2024.0,2.0,6.5,11000.0,"The story of how reggae icon Bob Marley overcame adversity, and the journey behind his revolutionary music.",0.0,0.0,0.0,0.0,1.0,0.0,0.0,0.0,0.0,0.0,0.0,False,True,False,False
Land of Bad,2024.0,2.0,6.5,7600.0,A US Army special forces unit is ambushed during a mission to retrieve an intelligence asset and their only remaining hope lies with a remote Air Force drone operator assisting them through a brutal 48-hour battle for survival.,1.0,0.0,0.0,0.0,0.0,0.0,1.0,0.0,0.0,0.0,0.0,False,False,False,True
Saltburn,2023.0,1.0,7.0,181000.0,"A student at Oxford University finds himself drawn into the world of a charming and aristocratic classmate, who invites him to his eccentric family's sprawling estate for a summer never to be forgotten.",0.0,0.0,0.0,1.0,1.0,0.0,1.0,0.0,0.0,0.0,0.0,False,False,True,False
The Iron Claw,2023.0,1.0,7.8,38000.0,"The true story of the inseparable Von Erich brothers, who made history in the intensely competitive world of professional wrestling in the early 1980s.",0.0,0.0,0.0,0.0,1.0,0.0,0.0,0.0,0.0,0.0,0.0,False,False,False,True
Argylle,2024.0,1.0,6.0,28000.0,"A reclusive author who writes espionage novels about a secret agent and a global spy syndicate realizes the plot of the new book she's writing starts to mirror real-world events, in real time.",1.0,0.0,0.0,0.0,0.0,0.0,1.0,0.0,0.0,0.0,0.0,False,True,False,False
One Day,2011.0,2.0,7.0,165000.0,"After spending the night together on the eve of their college graduation, Dexter and Emma are shown each year on the same date to see where they are in their lives. They are sometimes together, and sometimes not.",0.0,0.0,0.0,0.0,1.0,1.0,0.0,0.0,0.0,0.0,0.0,False,True,False,False
The Holdovers,2023.0,1.0,8.0,106000.0,A cranky history teacher at a remote prep school is forced to remain on campus over the holidays with a grieving cook and a troubled student who has no place to go.,0.0,0.0,0.0,1.0,1.0,0.0,0.0,0.0,0.0,0.0,0.0,False,False,False,True
The Beekeeper,2024.0,2.0,6.4,59000.0,"One man's brutal campaign for vengeance takes on national stakes after he is revealed to be a former operative of a powerful and clandestine organization known as ""Beekeepers"".",1.0,0.0,0.0,0.0,0.0,0.0,1.0,0.0,0.0,0.0,0.0,False,False,False,True
All of Us Strangers,2023.0,2.0,7.8,26000.0,A screenwriter drawn back to his childhood home enters into a fledgling relationship with his downstairs neighbor while discovering a mysterious new way to heal from losing his parents 30 years ago.,0.0,0.0,0.0,0.0,1.0,1.0,0.0,1.0,0.0,0.0,0.0,False,False,False,True
Thanksgiving,2023.0,2.0,6.3,40000.0,"After a Black Friday riot ends in tragedy, a mysterious Thanksgiving-inspired killer terrorizes Plymouth, Massachusetts - the birthplace of the infamous holiday.",0.0,0.0,0.0,0.0,0.0,0.0,1.0,0.0,1.0,1.0,0.0,False,False,True,False
Miller's Girl,2024.0,2.0,5.2,5100.0,A creative writing assignment yields complex results between a teacher and his talented student.,0.0,0.0,0.0,1.0,1.0,0.0,0.0,0.0,0.0,0.0,0.0,True,False,False,False
Anatomy of a Fall,2023.0,0.0,7.8,75000.0,A woman is suspected of murder after her husband's death; their half-blind son faces a moral dilemma as the main witness.,0.0,0.0,0.0,0.0,1.0,0.0,1.0,0.0,0.0,0.0,1.0,False,False,False,True
Upgraded,2024.0,2.0,6.1,12000.0,"When Ana is upgraded to first class on a work trip, she meets handsome Will, who mistakes Ana for her boss, Claire. A white lie then sets off a glamorous chain of events, romance and opportunity, until her fib threatens to surface.",0.0,0.0,0.0,1.0,0.0,1.0,0.0,0.0,0.0,0.0,0.0,True,False,False,False
Drive-Away Dolls,2024.0,3.0,6.1,3200.0,"Jamie regrets her breakup with her girlfriend, while Marian needs to relax. In search of a fresh start, they embark on an unexpected road trip to Tallahassee. Things quickly go awry when they cross paths with a group of inept criminals.",1.0,0.0,0.0,1.0,0.0,0.0,1.0,0.0,0.0,0.0,0.0,False,False,False,True
Mean Girls,2024.0,2.0,5.9,18000.0,"Cady Heron is a hit with the Plastics, an A-list girl clique at her new school. But everything changes when she makes the mistake of falling for Aaron Samuels, the ex-boyfriend of alpha Plastic Regina George.",0.0,0.0,0.0,1.0,0.0,0.0,0.0,0.0,0.0,0.0,0.0,False,True,False,False
This Is Me,2024.0,3.0,4.6,3400.0,"Coinciding with the release of her album of the same name, this narrative-driven odyssey tells the story of Jennifer Lopez's journey to love through her own eyes.",0.0,0.0,0.0,0.0,0.0,0.0,0.0,0.0,0.0,0.0,0.0,False,False,False,True
Killers of the Flower Moon,2023.0,0.0,7.7,211000.0,"When oil is discovered in 1920s Oklahoma under Osage Nation land, the Osage people are murdered one by one - until the FBI steps in to unravel the mystery.",0.0,0.0,0.0,0.0,1.0,0.0,0.0,0.0,0.0,0.0,1.0,False,False,False,True
Players,2024.0,2.0,5.6,6100.0,"A sports writer unused to relationships falls for a fling, leading her to reconsider playing the field in favor of commitment.",0.0,0.0,0.0,1.0,0.0,1.0,0.0,0.0,0.0,0.0,0.0,True,False,False,False
American Fiction,2023.0,2.0,7.6,33000.0,A novelist who's fed up with the establishment profiting from Black entertainment uses a pen name to write a book that propels him into the heart of the hypocrisy and madness he claims to disdain.,0.0,0.0,0.0,1.0,1.0,0.0,0.0,0.0,0.0,0.0,0.0,False,False,False,True
Wonka,2023.0,2.0,7.1,101000.0,"With dreams of opening a shop in a city renowned for its chocolate, a young and poor Willy Wonka discovers that the industry is run by a cartel of greedy chocolatiers.",0.0,1.0,0.0,1.0,0.0,0.0,0.0,0.0,0.0,0.0,0.0,False,True,False,False
The Marvels,2023.0,2.0,5.6,112000.0,"Carol Danvers gets her powers entangled with those of Kamala Khan and Monica Rambeau, forcing them to work together to save the universe.",1.0,1.0,0.0,0.0,0.0,0.0,0.0,1.0,0.0,0.0,0.0,False,True,False,False
Mission: Impossible - Dead Reckoning Part One,2023.0,0.0,7.7,234000.0,Ethan Hunt and his IMF team must track down a dangerous weapon before it falls into the wrong hands.,1.0,1.0,0.0,0.0,0.0,0.0,1.0,0.0,0.0,0.0,0.0,False,True,False,False
Past Lives,2023.0,2.0,7.9,93000.0,"Nora and Hae Sung, two deeply connected childhood friends, are wrested apart after Nora's family emigrates from South Korea. Twenty years later, they are reunited for one fateful week as they confront notions of love and destiny.",0.0,0.0,0.0,0.0,1.0,1.0,0.0,0.0,0.0,0.0,0.0,False,True,False,False
Barbie,2023.0,2.0,6.9,502000.0,"Barbie and Ken are having the time of their lives in the colorful and seemingly perfect world of Barbie Land. However, when they get a chance to go to the real world, they soon discover the joys and perils of living among humans.",0.0,1.0,0.0,1.0,0.0,0.0,0.0,1.0,0.0,0.0,0.0,False,True,False,False
Godzilla x Kong: The New Empire,2024.0,1.0,6.2,109728.57142857143,"Two ancient titans, Godzilla and Kong, clash in an epic battle as humans unravel their intertwined origins and connection to Skull Island's mysteries.",1.0,1.0,1.0,0.0,0.0,0.0,0.0,0.0,0.0,0.0,0.0,False,False,False,True
Lisa Frankenstein,2024.0,2.0,6.3,5500.0,"A coming of RAGE love story about a teenager and her crush, who happens to be a corpse. After a set of horrific circumstances bring him back to life, the two embark on a journey to find love, happiness - and a few missing body parts.",0.0,0.0,0.0,1.0,0.0,1.0,0.0,0.0,1.0,0.0,0.0,False,False,False,True
Society of the Snow,2023.0,1.0,7.8,110000.0,The flight of a rugby team crashes on a glacier in the Andes. The few passengers who survive the crash find themselves in one of the world's toughest environments to survive.,0.0,1.0,0.0,0.0,1.0,0.0,0.0,0.0,0.0,0.0,0.0,True,False,False,False
No Way Up,2024.0,2.0,4.5,2100.0,Characters from different backgrounds are thrown together when the plane they're travelling on crashes into the Pacific Ocean. A nightmare fight for survival ensues with the air supply running out and dangers creeping in from all sides.,1.0,1.0,0.0,0.0,1.0,0.0,0.0,0.0,0.0,0.0,0.0,True,False,False,False
One Life,2023.0,2.0,7.6,7900.0,"Sir Nicholas 'Nicky' Winton, a young London broker who, in the months leading up to World War II, rescued over 600 children from Nazi-occupied Czechoslovakia.",0.0,0.0,0.0,0.0,1.0,0.0,0.0,0.0,0.0,0.0,0.0,False,True,False,False
Boy Kills World,2023.0,2.0,6.4,330.0,"A dystopian fever dream action film that follows Boy, a deaf person with a vibrant imagination. When his family is murdered, he is trained by a mysterious shaman to repress his childish imagination and become an instrument of death.",1.0,0.0,0.0,0.0,0.0,0.0,1.0,0.0,0.0,0.0,0.0,True,False,False,False
X,2022.0,2.0,6.5,167000.0,"In 1979, a group of young filmmakers set out to make an adult film in rural Texas, but when their reclusive, elderly hosts catch them in the act, the cast find themselves fighting for their lives.",0.0,0.0,0.0,0.0,0.0,0.0,1.0,0.0,1.0,1.0,0.0,False,False,False,True
The Color Purple,2023.0,1.0,7.0,12000.0,"A woman faces many hardships in her life, but ultimately finds extraordinary strength and hope in the unbreakable bonds of sisterhood.",0.0,0.0,0.0,0.0,1.0,0.0,0.0,0.0,0.0,0.0,0.0,False,True,False,False
Teri Baaton Mein Aisa Uljha Jiya,2024.0,1.0,7.0,42000.0,"Aryan is not able to find a perfect life partner. He meets a perfect girl, Sifra, during an official assignment in the US and falls in love with her only to discover later that it's an impossible love story.",0.0,0.0,0.0,1.0,1.0,1.0,0.0,0.0,0.0,0.0,0.0,False,True,False,False
Civil War,2024.0,2.0,5.971428571428572,11601.0,"At the height of a modern American civil war, two journalists and a young amateur photographer embark on a dangerous trip to Washington DC in an effort to interview the President.",1.0,0.0,0.0,0.0,0.0,0.0,0.0,0.0,0.0,0.0,0.0,False,False,False,True
The Last Airbender,2010.0,2.0,4.0,172000.0,"Follows the adventures of Aang, a young successor to a long line of Avatars, who must master all four elements and stop the Fire Nation from enslaving the Water Tribes and the Earth Kingdom.",1.0,1.0,0.0,0.0,0.0,0.0,0.0,0.0,0.0,0.0,0.0,False,True,False,False
The Hunger Games: The Ballad of Songbirds & Snakes,2023.0,0.0,6.8,102000.0,Coriolanus Snow mentors and develops feelings for the female District 12 tribute during the 10th Hunger Games.,1.0,1.0,0.0,0.0,1.0,0.0,0.0,0.0,0.0,0.0,0.0,False,True,False,False
Animal,2023.0,0.0,6.3,83000.0,The hardened son of a powerful industrialist returns home after years abroad and vows to take bloody revenge on those threatening his father's life.,1.0,0.0,0.0,0.0,1.0,0.0,0.0,0.0,0.0,0.0,1.0,False,False,True,False
Challengers,2024.0,1.0,6.728571428571429,8189.0,"Tashi, a former tennis prodigy turned coach is married to a champion on a losing streak. Her strategy for her husband's redemption takes a surprising turn when he must face off against his former best friend and Tashi's former boyfriend.",0.0,0.0,0.0,0.0,1.0,1.0,0.0,0.0,0.0,0.0,0.0,True,False,False,False
Crossroads,2002.0,2.0,3.7,43000.0,"Three childhood friends embark on a cross-country adventure to pursue dreams they once put aside, taking risks that are sure to change their lives forever.",0.0,0.0,0.0,1.0,1.0,1.0,0.0,0.0,0.0,0.0,0.0,False,True,False,False
How to Have Sex,2023.0,2.0,6.5,11000.0,"Three British teenage girls go on a rites-of-passage holiday - drinking, clubbing and hooking up, in what should be the best summer of their lives.",0.0,0.0,0.0,0.0,1.0,0.0,0.0,0.0,0.0,0.0,0.0,False,False,False,True
Dune,1984.0,1.0,6.3,172000.0,A Duke's son leads desert warriors against the galactic emperor and his father's evil nemesis to free their desert world from the emperor's rule.,1.0,1.0,1.0,0.0,0.0,0.0,0.0,0.0,0.0,0.0,0.0,False,True,False,False
Aquaman and the Lost Kingdom,2023.0,1.0,5.7,62000.0,"Black Manta seeks revenge on Aquaman for his father's death. Wielding the Black Trident's power, he becomes a formidable foe. To defend Atlantis, Aquaman forges an alliance with his imprisoned brother. They must protect the kingdom.",1.0,1.0,0.0,0.0,0.0,0.0,0.0,1.0,0.0,0.0,0.0,False,True,False,False
Leave the World Behind,2023.0,1.0,6.5,183000.0,"A family's getaway to a luxurious rental home takes an ominous turn when a cyberattack knocks out their devices, and two strangers appear at their door.",0.0,0.0,0.0,0.0,1.0,0.0,1.0,0.0,0.0,1.0,0.0,False,False,False,True
Einstein and the Bomb,2024.0,3.0,6.2,2000.0,"What happened after Einstein fled Nazi Germany? Using archival footage and his own words, this docudrama dives into the mind of a tortured genius.",0.0,0.0,0.0,0.0,0.0,0.0,0.0,0.0,0.0,0.0,0.0,True,False,False,False
Dunki,2023.0,0.0,6.8,69000.0,"When his friends in Punjab struggle to clear the immigration process, an ex-soldier guides them on a risky journey to enter the UK without permission.",0.0,0.0,0.0,1.0,1.0,0.0,0.0,0.0,0.0,0.0,0.0,False,False,False,True
Once Upon a Time,2019.0,0.0,7.6,835000.0,A faded television actor and his stunt double strive to achieve fame and success in the final years of Hollywood's Golden Age in 1969 Los Angeles.,0.0,0.0,0.0,1.0,1.0,0.0,0.0,0.0,0.0,0.0,0.0,False,False,False,True
Migration,2023.0,3.0,6.7,18000.0,A family of ducks try to convince their overprotective father to go on the vacation of a lifetime.,0.0,1.0,0.0,1.0,0.0,0.0,0.0,0.0,0.0,0.0,0.0,False,True,False,False
12th Fail,2023.0,1.0,9.1,100000.0,The real-life story of IPS Officer Manoj Kumar Sharma and IRS Officer Shraddha Joshi.,0.0,0.0,0.0,0.0,1.0,0.0,0.0,0.0,0.0,0.0,0.0,False,True,False,False
Perfect Days,2023.0,1.0,7.9,17000.0,"Hirayama cleans public toilets in Tokyo, lives his life in simplicity and daily tranquility. Some encounters also lead him to reflect on himself.",0.0,0.0,0.0,0.0,1.0,0.0,0.0,0.0,0.0,0.0,0.0,False,True,False,False
Next Goal Wins,2023.0,2.0,6.5,15000.0,"The story of the infamously terrible American Samoa soccer team, known for a brutal 2001 FIFA match they lost 31-0.",0.0,0.0,0.0,1.0,1.0,0.0,0.0,0.0,0.0,0.0,0.0,False,True,False,False
The Shawshank Redemption,1994.0,1.0,9.3,2900000.0,"Over the course of several years, two convicts form a friendship, seeking consolation and, eventually, redemption through basic compassion.",0.0,0.0,0.0,0.0,1.0,0.0,0.0,0.0,0.0,0.0,0.0,False,False,False,True
The Creator,2023.0,1.0,6.8,146000.0,"Against the backdrop of a war between humans and robots with artificial intelligence, a former soldier finds the secret weapon, a robot in the form of a young child.",1.0,1.0,0.0,0.0,1.0,0.0,0.0,0.0,0.0,0.0,0.0,False,True,False,False
Starship Troopers,1997.0,1.0,7.3,317000.0,"Humans, in a fascist militaristic future, wage war with giant alien bugs.",1.0,1.0,1.0,0.0,0.0,0.0,0.0,0.0,0.0,0.0,0.0,False,False,True,False
Interstellar,2014.0,0.0,8.7,2100000.0,"When Earth becomes uninhabitable in the future, a farmer and ex-NASA pilot, Joseph Cooper, is tasked to pilot a spacecraft, along with a team of researchers, to find a new planet for humans.",0.0,1.0,1.0,0.0,1.0,0.0,0.0,0.0,0.0,0.0,0.0,False,True,False,False
Maestro,2023.0,1.0,6.6,52000.0,This love story chronicles the lifelong relationship of conductor-composer Leonard Bernstein and actress Felicia Montealegre Cohn Bernstein.,0.0,0.0,0.0,0.0,1.0,0.0,0.0,0.0,0.0,0.0,0.0,False,False,False,True
Lights Out,2024.0,2.0,4.9,597.0,"A drifting ex-soldier turns underground fighter with the help of a just released ex-con, pitting them both against a crime boss, corrupt cops and hired killers.",1.0,0.0,0.0,0.0,0.0,0.0,1.0,0.0,0.0,0.0,0.0,True,False,False,False
Damsel,2024.0,2.0,6.142857142857143,48590.71428571428,"A dutiful damsel agrees to marry a handsome prince, only to find the royal family has recruited her as a sacrifice to repay an ancient debt.",1.0,1.0,0.0,0.0,0.0,0.0,0.0,1.0,0.0,0.0,0.0,False,False,False,True
Orion and the Dark,2024.0,2.0,6.4,9500.0,"A boy with an active imagination faces his fears on an unforgettable journey through the night with his new friend: a giant, smiling creature named Dark.",0.0,1.0,0.0,1.0,0.0,0.0,0.0,0.0,0.0,0.0,0.0,False,True,False,False
Ordinary Angels,2024.0,2.0,7.9,806.0,Inspired by the incredible true story of a hairdresser who single-handedly rallies an entire community to help a widowed father save the life of his critically ill young daughter.,0.0,0.0,0.0,0.0,1.0,0.0,0.0,0.0,0.0,0.0,0.0,False,True,False,False
Memory,2023.0,2.0,6.7,1900.0,Sylvia is a social worker who leads a simple and structured life. This is blown open when Saul follows her home from their high school reunion. Their surprise encounter will profoundly impact both of them as they open the door to the past.,0.0,0.0,0.0,0.0,1.0,0.0,0.0,0.0,0.0,0.0,0.0,False,False,False,True
Bottoms,2023.0,2.0,6.8,36000.0,Two unpopular queer high-school students start a fight club to have sex before graduation.,0.0,0.0,0.0,1.0,0.0,0.0,0.0,0.0,0.0,0.0,0.0,False,False,False,True
Love Lies Bleeding,2024.0,2.0,6.114285714285714,48441.857142857145,"Gym manager Lou falls for Jackie, a bodybuilder who is passing through town en route to a competition in Las Vegas.",1.0,1.0,0.0,0.0,0.0,0.0,0.0,0.0,0.0,0.0,1.0,False,False,True,False
Ferrari,2023.0,1.0,6.5,30000.0,"Set in the summer of 1957, with Enzo Ferrari's auto empire in crisis, the ex-racer turned entrepreneur pushes himself and his drivers to the edge as they launch into the Mille Miglia, a treacherous 1,000-mile race across Italy.",0.0,0.0,0.0,0.0,1.0,0.0,0.0,0.0,0.0,0.0,0.0,False,False,False,True
Rebel Moon - Part One: A Child of Fire,2023.0,1.0,5.6,100000.0,"When a peaceful settlement on the edge of a distant moon finds itself threatened by the armies of a tyrannical ruling force, a mysterious stranger living among its villagers becomes their best hope for survival.",1.0,1.0,0.0,0.0,1.0,0.0,0.0,0.0,0.0,0.0,0.0,False,False,False,True
Napoleon,2023.0,0.0,6.4,113000.0,"An epic that details the checkered rise and fall of French Emperor Napoleon Bonaparte and his relentless journey to power through the prism of his addictive, volatile relationship with his wife, Josephine.",1.0,1.0,0.0,0.0,0.0,0.0,0.0,0.0,0.0,0.0,0.0,False,False,False,True
Priscilla,2023.0,2.0,6.6,26000.0,"When teenage Priscilla Beaulieu meets Elvis Presley, the man who is already a meteoric rock-and-roll superstar becomes someone entirely unexpected in private moments: a thrilling crush, an ally in loneliness, a vulnerable best friend.",0.0,0.0,0.0,0.0,1.0,0.0,0.0,0.0,0.0,0.0,0.0,False,False,False,True
The Godfather,1972.0,0.0,9.2,2000000.0,The aging patriarch of an organized crime dynasty transfers control of his clandestine empire to his reluctant son.,0.0,0.0,0.0,0.0,1.0,0.0,0.0,0.0,0.0,0.0,1.0,False,False,True,False
Ghostbusters: Frozen Empire,2024.0,1.0,6.971428571428571,99208.42857142857,"When the discovery of an ancient artifact unleashes an evil force, Ghostbusters new and old must join forces to protect their home and save the world from a second ice age.",0.0,1.0,0.0,1.0,0.0,0.0,0.0,1.0,0.0,0.0,0.0,False,False,False,True
Midsommar,2019.0,1.0,7.1,395000.0,A couple travels to Northern Europe to visit a rural hometown's fabled Swedish mid-summer festival. What begins as an idyllic retreat quickly devolves into an increasingly violent and bizarre competition at the hands of a pagan cult.,0.0,0.0,0.0,0.0,1.0,0.0,0.0,0.0,1.0,1.0,0.0,False,False,True,False
Wicked Little Letters,2023.0,2.0,7.1,1800.0,"When people in Littlehampton--including conservative local Edith--begin to receive letters full of hilarious profanities, rowdy Irish migrant Rose is charged with the crime. Suspecting that something is amiss, the town's women investigate.",0.0,0.0,0.0,1.0,1.0,0.0,0.0,0.0,0.0,0.0,1.0,True,False,False,False
Navalny,2022.0,2.0,7.7,29000.0,Follows the man who survived an assassination attempt by poisoning with a lethal nerve agent in August 2020. During his months-long recovery he makes shocking discoveries about the attempt on his life and decides to return home.,0.0,0.0,0.0,0.0,0.0,0.0,0.0,0.0,0.0,0.0,0.0,False,False,False,True
Gran Turismo,2023.0,1.0,7.2,90000.0,"Based on the unbelievable, inspiring true story of a team of underdogs - a struggling, working-class gamer, a failed former race car driver, and an idealistic motorsport exec - who risk it all to take on the most elite sport in the world.",1.0,1.0,0.0,0.0,1.0,0.0,0.0,0.0,0.0,0.0,0.0,False,True,False,False
Mea Culpa,2024.0,1.0,4.1,2900.0,"Follows an ambitious criminal defense attorney that, in her aspiration to be named partner, takes on the case of an artist accused of murdering his girlfriend.",0.0,0.0,0.0,0.0,1.0,0.0,1.0,0.0,0.0,0.0,1.0,True,False,False,False
The Dark Knight,2008.0,0.0,9.0,2800000.0,"When the menace known as the Joker wreaks havoc and chaos on the people of Gotham, Batman must accept one of the greatest psychological and physical tests of his ability to fight injustice.",1.0,0.0,0.0,0.0,1.0,0.0,0.0,0.0,0.0,0.0,1.0,False,True,False,False
Godzilla Minus One,2023.0,1.0,8.3,45000.0,"Post war Japan is at its lowest point when a new crisis emerges in the form of a giant monster, baptized in the horrific power of the atomic bomb.",1.0,1.0,0.0,0.0,1.0,0.0,0.0,0.0,0.0,0.0,0.0,False,False,False,True
Kung Fu Panda 4,2024.0,2.0,6.185714285714285,21190.714285714286,"After Po is tapped to become the Spiritual Leader of the Valley of Peace, he needs to find and train a new Dragon Warrior, while a wicked sorceress plans to re-summon all the master villains whom Po has vanquished to the spirit realm.",1.0,1.0,0.0,0.0,0.0,0.0,0.0,0.0,0.0,0.0,0.0,False,True,False,False
No Hard Feelings,2023.0,2.0,6.4,150000.0,"On the brink of losing her home, Maddie finds an intriguing job listing: helicopter parents looking for someone to bring their introverted 19-year-old son out of his shell before college. She has one summer to make him a man or die trying.",0.0,0.0,0.0,1.0,0.0,1.0,0.0,0.0,0.0,0.0,0.0,False,False,False,True
Everything Everywhere All at Once,2022.0,1.0,7.8,520000.0,A middle-aged Chinese immigrant is swept up into an insane adventure in which she alone can save existence by exploring other universes and connecting with the lives she could have led.,1.0,1.0,0.0,1.0,0.0,0.0,0.0,0.0,0.0,0.0,0.0,False,False,False,True
Spider-Man: Across the Spider-Verse,2023.0,1.0,8.6,351000.0,"Miles Morales catapults across the multiverse, where he encounters a team of Spider-People charged with protecting its very existence. When the heroes clash on how to handle a new threat, Miles must redefine what it means to be a hero.",1.0,1.0,0.0,0.0,0.0,0.0,0.0,0.0,0.0,0.0,0.0,False,True,False,False
Don't Worry Darling,2022.0,1.0,6.3,143000.0,"While her husband leaves home everyday to work in a top secret facility, a young 1950s housewife begins to question her life when she notices strange behavior from the other wives in the neighborhood.",0.0,0.0,0.0,0.0,1.0,0.0,1.0,0.0,0.0,1.0,0.0,False,False,False,True
May December,2023.0,2.0,6.9,45000.0,"Twenty years after their notorious tabloid romance gripped the nation, a married couple buckles under pressure when an actress arrives to do research for a film about their past.",0.0,0.0,0.0,1.0,1.0,0.0,0.0,0.0,0.0,0.0,0.0,False,False,False,True
The Batman,2022.0,0.0,7.8,773000.0,"When a sadistic serial killer begins murdering key political figures in Gotham, Batman is forced to investigate the city's hidden corruption and question his family's involvement.",1.0,0.0,0.0,0.0,1.0,0.0,0.0,0.0,0.0,0.0,1.0,False,True,False,False
Road House,2024.0,2.0,5.442857142857142,10726.0,"Ex-UFC fighter Dalton (Jake Gyllenhaal) takes a job as a bouncer at a Florida Keys roadhouse, only to discover that this paradise is not all it seems.",1.0,0.0,0.0,0.0,0.0,0.0,1.0,0.0,0.0,0.0,0.0,True,False,False,False
Suncoast,2024.0,2.0,6.6,3500.0,"While caring for her brother along with her audacious mother, a teenager strikes up a friendship with an eccentric activist who is protesting one of the most landmark medical cases of all time.",0.0,0.0,0.0,0.0,1.0,0.0,0.0,0.0,0.0,0.0,0.0,True,False,False,False
