title,released_year,run_time,stars,total_ratings,summary,Action,Adventure,Sci-Fi,Comedy,Drama,Romance,Thriller,Fantasy,Horror,Mystery,Crime,Adults,Kids,Other,Teens
Oye Bhole Oye,2024.0,1.0,8.7,133.0,"Bhola's quest for work in the city leads him to Aveera, a rich woman drawn to his simple life. But their romance faces trouble when Bhola must save his village.",0.0,0.0,0.0,0.0,1.0,0.0,0.0,0.0,0.0,0.0,0.0,False,True,False,False
17 Again,2009.0,2.0,6.4,215000.0,Mike O'Donnell is ungrateful for how his life turned out. He gets a chance to rewrite his life when he tried to save a janitor near a bridge and jumped after him into a time vortex.,0.0,0.0,0.0,1.0,1.0,0.0,0.0,1.0,0.0,0.0,0.0,False,True,False,False
Body Heat,1981.0,2.0,7.4,40000.0,"A beautiful Florida woman seduces a seedy lawyer, with the hidden agenda of having him kill her rich husband.",0.0,0.0,0.0,0.0,1.0,1.0,0.0,0.0,0.0,0.0,1.0,False,False,False,True
Trouble with the Curve,2012.0,2.0,6.8,68000.0,"A daughter tries to remedy her dysfunctional relationship with her ailing father, a decorated baseball scout, by helping him in a recruiting trip which could be his last.",0.0,0.0,0.0,0.0,1.0,0.0,0.0,0.0,0.0,0.0,0.0,False,True,False,False
Bandit,2022.0,1.0,6.4,13000.0,"After escaping a Michigan prison, a charming career criminal assumes a new identity in Canada and goes on to rob a record 59 banks and jewellery stores while being hunted by a police task force. Based on the story of The Flying Bandit.",0.0,0.0,0.0,0.0,1.0,0.0,1.0,0.0,0.0,0.0,1.0,False,False,False,True
Four Brothers,2005.0,2.0,6.8,156000.0,"When their adoptive mother is gunned down in a store robbery, four brothers decide to investigate the murder and find the killers themselves, but not all is what it seems.",1.0,0.0,0.0,0.0,1.0,0.0,0.0,0.0,0.0,0.0,1.0,False,False,True,False
The Birdcage,1996.0,2.0,7.2,100000.0,A gay cabaret owner and his drag queen companion agree to put up a false straight front so that their son can introduce them to his fiancée's right-wing moralistic parents.,0.0,0.0,0.0,1.0,0.0,0.0,0.0,0.0,0.0,0.0,0.0,False,True,False,False
Code 8: Part II,2024.0,2.0,5.8,1700.0,"Follows a girl fighting to get justice for her slain brother by corrupt police officers. She enlists the help of an ex-con and his former partner, they face a highly regarded and well protected police sergeant who doesn't want to be.",1.0,0.0,0.0,0.0,1.0,0.0,0.0,0.0,0.0,0.0,1.0,False,True,False,False
Goodnight Mommy,2022.0,2.0,5.7,14000.0,Twin brothers arrive at their mother's house and begin to suspect that something isn't right.,0.0,0.0,0.0,0.0,1.0,0.0,0.0,0.0,1.0,0.0,1.0,False,False,False,True
Foxcatcher,2014.0,1.0,7.0,149000.0,"U.S. Olympic wrestling champions and brothers Mark Schultz and Dave Schultz join ""Team Foxcatcher"", led by eccentric multi-millionaire John du Pont, as they train for the 1988 Olympic Games in Seoul, South Korea, but John's self-destructive behavior threatens to consume them all.",0.0,0.0,0.0,0.0,1.0,0.0,0.0,0.0,0.0,0.0,0.0,False,True,False,False
Deliver Us,2023.0,2.0,4.8,1800.0,"When a nun in a remote convent claims immaculate conception, the Vatican sends a team of priests to investigate, concerned about an ancient prophecy that a woman will give birth to twin boys: one the Messiah, the other the Anti-Christ.",0.0,0.0,0.0,0.0,0.0,0.0,0.0,0.0,1.0,0.0,0.0,False,False,True,False
American Symphony,2023.0,2.0,6.8,3000.0,"In this deeply intimate documentary, musician Jon Batiste attempts to compose a symphony as his wife, writer Suleika Jaouad, undergoes cancer treatment.",0.0,0.0,0.0,0.0,0.0,0.0,0.0,0.0,0.0,0.0,0.0,False,False,False,True
Lucky Number Slevin,2006.0,2.0,7.7,325000.0,"A case of mistaken identity lands Slevin into the middle of a war being plotted by two of the city's most rival crime bosses. Under constant surveillance by Detective Brikowski and assassin Goodkat, he must get them before they get him.",0.0,0.0,0.0,0.0,1.0,0.0,1.0,0.0,0.0,0.0,1.0,False,False,True,False
Savages,2012.0,1.0,6.4,134000.0,Pot growers Ben and Chon face off against the Mexican drug cartel who kidnapped their shared girlfriend.,1.0,0.0,0.0,0.0,1.0,0.0,0.0,0.0,0.0,0.0,1.0,False,False,True,False
Stick It,2006.0,2.0,6.4,30000.0,"After a run-in with the law, Haley is forced to return to the world from which she fled years ago. Enrolled in an elite gymnastics program run by the legendary Burt Vickerman, Haley's rebellious attitude slowly gives way to a team spirit.",0.0,0.0,0.0,1.0,1.0,0.0,0.0,0.0,0.0,0.0,0.0,False,True,False,False
Dreamgirls,2006.0,1.0,6.6,77000.0,"A trio of black female soul singers cross over to the pop charts in the early 1960s, facing their own personal struggles along the way.",0.0,0.0,0.0,0.0,1.0,0.0,0.0,0.0,0.0,0.0,0.0,False,True,False,False
Dirty Harry,1971.0,2.0,7.7,167000.0,"When a man calling himself ""the Scorpio Killer"" menaces San Francisco, tough-as-nails Police Inspector ""Dirty"" Harry Callahan is assigned to track down the crazed psychopath.",1.0,0.0,0.0,0.0,0.0,0.0,1.0,0.0,0.0,0.0,1.0,False,False,False,True
Cold Pursuit,2019.0,2.0,6.2,78000.0,A grieving snowplow driver seeks out revenge against the drug dealers who killed his son.,1.0,0.0,0.0,1.0,0.0,0.0,0.0,0.0,0.0,0.0,1.0,False,False,False,True
Imagine Me & You,2005.0,2.0,6.7,36000.0,"A newlywed bride becomes infatuated with another woman who questions her sexual orientation, promoting a stir among the bride's family and friends.",0.0,0.0,0.0,1.0,1.0,1.0,0.0,0.0,0.0,0.0,0.0,False,False,False,True
The Poughkeepsie Tapes,2007.0,3.0,6.0,24000.0,"In an abandoned house in Poughkeepsie, New York murder investigators uncover hundreds of tapes showing decades of a serial killer's work.",0.0,0.0,0.0,0.0,0.0,0.0,1.0,0.0,1.0,1.0,0.0,True,False,False,False
Young Guns,1988.0,2.0,6.8,67000.0,"A group of young gunmen, led by Billy the Kid, become deputies to avenge the murder of the rancher who became their benefactor. But when Billy takes their authority too far, they become the hunted.",1.0,0.0,0.0,0.0,1.0,0.0,0.0,0.0,0.0,0.0,0.0,False,False,False,True
Indecent Proposal,1993.0,2.0,6.0,78000.0,"A billionaire offers $1,000,000 to a young married couple for one night with the wife.",0.0,0.0,0.0,0.0,1.0,1.0,0.0,0.0,0.0,0.0,0.0,False,False,False,True
Frozen,2010.0,2.0,6.2,80000.0,"Three skiers stranded on a chairlift are forced to make life-or-death choices, which prove more perilous than staying put and freezing to death.",0.0,1.0,0.0,0.0,0.0,0.0,1.0,0.0,0.0,0.0,0.0,False,False,False,True
Raw,2016.0,2.0,7.0,88000.0,"A young woman, studying to be a vet, develops a craving for human flesh.",0.0,0.0,0.0,0.0,1.0,0.0,0.0,0.0,1.0,0.0,0.0,True,False,False,False
Your Place or Mine,2023.0,2.0,5.7,38000.0,Two long-distance best friends change each other's lives when she decides to pursue a lifelong dream and he volunteers to keep an eye on her teenage son.,0.0,0.0,0.0,1.0,0.0,1.0,0.0,0.0,0.0,0.0,0.0,False,False,False,True
Angels & Demons,2009.0,1.0,6.7,308000.0,Harvard symbologist Robert Langdon works with a nuclear physicist to solve a murder and prevent a terrorist act against the Vatican during one of the significant events within the church.,1.0,0.0,0.0,0.0,0.0,0.0,1.0,0.0,0.0,1.0,0.0,False,False,False,True
Anger Management,2003.0,2.0,6.2,227000.0,"Dave Buznik is a businessman who is wrongly sentenced to an anger management program, where he meets an aggressive instructor.",0.0,0.0,0.0,1.0,0.0,0.0,0.0,0.0,0.0,0.0,0.0,False,False,False,True
Pitch Perfect 3,2017.0,2.0,5.8,71000.0,"Following their win at the world championship, the now separated Bellas reunite for one last singing competition at an overseas USO tour, but face a group who uses both instruments and voices.",0.0,0.0,0.0,1.0,0.0,0.0,0.0,0.0,0.0,0.0,0.0,False,True,False,False
The Karate Kid Part II,1986.0,2.0,6.1,98000.0,"Daniel accompanies his mentor, Mr. Miyagi, to Miyagi's childhood home in Okinawa. Miyagi visits his dying father and confronts his old rival, while Daniel falls in love and inadvertently makes a new rival of his own.",1.0,0.0,0.0,0.0,0.0,0.0,0.0,0.0,0.0,0.0,0.0,False,True,False,False
Good Burger 2,2023.0,2.0,5.3,3300.0,"After his latest invention fails, Dex is welcomed back by Ed to his old job at Good Burger, which is once again put in jeopardy when Dex devises a plan to get back on his feet.",0.0,0.0,0.0,1.0,0.0,0.0,0.0,0.0,0.0,0.0,0.0,False,True,False,False
King Kong,1976.0,1.0,6.0,35000.0,A petroleum exploration expedition comes to an isolated island and encounters a colossal giant gorilla.,0.0,1.0,0.0,0.0,0.0,0.0,0.0,0.0,1.0,0.0,0.0,False,True,False,False
A Silent Voice: The Movie,2016.0,1.0,8.1,99000.0,"A young man is ostracized by his classmates after he bullies a deaf girl to the point where she moves away. Years later, he sets off on a path for redemption.",0.0,0.0,0.0,0.0,1.0,0.0,0.0,0.0,0.0,0.0,0.0,False,True,False,False
The Break-Up,2006.0,2.0,5.8,138000.0,A couple's break-up proceeds to get uglier and nastier by the moment as each tries to keep their luxurious condo from the other.,0.0,0.0,0.0,1.0,1.0,1.0,0.0,0.0,0.0,0.0,0.0,False,True,False,False
Endless Love,1981.0,2.0,4.9,9500.0,"Parental disapproval of a passionate romance between two teenagers leads to arguments, circumstance, insanity and tragedy.",0.0,0.0,0.0,0.0,1.0,1.0,0.0,0.0,0.0,0.0,0.0,False,False,False,True
The Obscure Spring,2014.0,2.0,6.2,747.0,"Igor and Pina long for each other but cannot act. When spring comes, their passions are unleashed, though burdened by guilt.",0.0,0.0,0.0,0.0,1.0,0.0,0.0,0.0,0.0,0.0,0.0,True,False,False,False
The Italian Job,1969.0,2.0,7.2,50000.0,A comic caper movie about a plan to steal a gold shipment from the streets of Turin by creating a traffic jam.,1.0,0.0,0.0,1.0,0.0,0.0,0.0,0.0,0.0,0.0,1.0,False,True,False,False
The Unforgivable,2021.0,2.0,7.1,118000.0,A woman is released from prison after serving a sentence for a violent crime and re-enters a society that refuses to forgive her past.,0.0,0.0,0.0,0.0,1.0,0.0,0.0,0.0,0.0,1.0,1.0,False,False,False,True
From Beyond,1986.0,3.0,6.6,30000.0,"A group of scientists have developed the Resonator, a machine which allows whoever is within range to see beyond normal perceptible reality. But when the experiment succeeds, they are immediately attacked by terrible life forms.",0.0,0.0,1.0,0.0,0.0,0.0,0.0,0.0,1.0,0.0,0.0,False,False,False,True
Yolo,2024.0,1.0,6.9,431.0,"After argument with younger sister, Le Ying moves out on her own. She meets a boxing trainer and starts boxing.",0.0,0.0,0.0,1.0,1.0,0.0,0.0,0.0,0.0,0.0,0.0,False,False,False,True
The Way,2010.0,1.0,7.3,35000.0,"A father heads overseas to recover the body of his estranged son who died while traveling the ""El camino de Santiago,"" and decides to take the pilgrimage himself.",0.0,0.0,0.0,1.0,1.0,0.0,0.0,0.0,0.0,0.0,0.0,False,False,False,True
Hanna,2011.0,2.0,6.7,206000.0,"A sixteen-year-old girl who was raised by her father to be the perfect assassin is dispatched on a mission across Europe, tracked by a ruthless intelligence agent and her operatives.",1.0,1.0,0.0,0.0,1.0,0.0,0.0,0.0,0.0,0.0,0.0,False,False,False,True
Alice in Wonderland,1951.0,3.0,7.3,153000.0,Alice stumbles into the world of Wonderland. Will she get home? Not if the Queen of Hearts has her way.,0.0,1.0,0.0,1.0,0.0,0.0,0.0,0.0,0.0,0.0,0.0,False,True,False,False
Wild Rose,2018.0,2.0,7.1,15000.0,A troubled young Glaswegian woman dreams of becoming a Nashville country star.,0.0,0.0,0.0,0.0,1.0,0.0,0.0,0.0,0.0,0.0,0.0,False,False,False,True
The Outpost,2019.0,1.0,6.8,40000.0,A small team of U.S. soldiers battles against hundreds of Taliban fighters in Afghanistan.,1.0,0.0,0.0,0.0,1.0,0.0,0.0,0.0,0.0,0.0,0.0,False,False,True,False
The Disaster Artist,2017.0,2.0,7.3,163000.0,"When aspiring actor Greg Sestero meets the weird and mysterious Tommy Wiseau in an acting class, they form a unique friendship and travel to Hollywood to make their dreams come true.",0.0,0.0,0.0,1.0,1.0,0.0,0.0,0.0,0.0,0.0,0.0,False,False,False,True
The Falling,2014.0,2.0,5.3,7800.0,"It's 1969 at a strict English girls' school where charismatic Abbie and intense and troubled Lydia are best friends. After a tragedy occurs at the school, a mysterious fainting epidemic breaks out threatening the stability of all involved.",0.0,0.0,0.0,0.0,1.0,0.0,1.0,0.0,0.0,1.0,0.0,False,False,False,True
The Quiet Girl,2022.0,2.0,7.7,21000.0,"In rural Ireland, a quiet, neglected girl is sent away from her dysfunctional family to live with relatives for the summer where she blossoms and learns what it is to be loved.",0.0,0.0,0.0,0.0,1.0,0.0,0.0,0.0,0.0,0.0,0.0,False,True,False,False
The Conjuring: The Devil Made Me Do It,2021.0,2.0,6.3,137000.0,"Arne Cheyenne Johnson stabs and murders his landlord, claiming to be under demonic possession while Ed and Lorraine Warren investigate the case and try to prove his innocence.",0.0,0.0,0.0,0.0,0.0,0.0,1.0,0.0,1.0,1.0,0.0,False,False,False,True
Thirteen Lives,2022.0,1.0,7.8,67000.0,A rescue mission is assembled in Thailand where a group of young boys and their soccer coach are trapped in a system of underground caves that are flooding.,1.0,1.0,0.0,0.0,0.0,0.0,0.0,0.0,0.0,0.0,0.0,False,False,False,True
The Lost City of Z,2016.0,1.0,6.6,99000.0,"A true-life drama, centering on British explorer Major Percival Fawcett, who disappeared whilst searching for a mysterious city in the Amazon in the 1920s.",0.0,1.0,0.0,0.0,1.0,0.0,0.0,0.0,0.0,0.0,0.0,False,False,False,True
Influencer,2022.0,2.0,6.2,13000.0,"While struggling on a solo backpacking trip in Thailand, social media influencer Madison meets CW, who travels with ease and shows her a more uninhibited way of living, but CW's interest in her takes a darker turn.",0.0,0.0,0.0,0.0,0.0,0.0,1.0,0.0,1.0,1.0,0.0,True,False,False,False
Widows,2018.0,1.0,6.8,104000.0,Four women with nothing in common except a debt left behind by their dead husbands' criminal activities take fate into their own hands and conspire to forge a future on their own terms.,0.0,0.0,0.0,0.0,1.0,0.0,1.0,0.0,0.0,0.0,1.0,False,False,False,True
How the West Was Won,1962.0,0.0,7.0,23000.0,"A family saga covering several decades of Westward expansion in the 19th century, including the Gold Rush, the Civil War, and the building of the railroads.",0.0,1.0,0.0,0.0,0.0,0.0,0.0,0.0,0.0,0.0,0.0,False,True,False,False
12 Feet Deep,2017.0,3.0,5.2,17000.0,Two sisters are trapped under the fiberglass cover of an Olympic sized public pool and must brave the cold and each other to survive the harrowing night.,0.0,0.0,0.0,0.0,0.0,0.0,1.0,0.0,1.0,0.0,0.0,False,False,True,False
Finding Dory,2016.0,2.0,7.2,301000.0,Friendly but forgetful blue tang Dory begins a search for her long-lost parents and everyone learns a few things about the real meaning of family along the way.,0.0,1.0,0.0,1.0,0.0,0.0,0.0,0.0,0.0,0.0,0.0,False,True,False,False
MILF,2018.0,2.0,4.8,7200.0,Three best friends in their forties start a relationship with younger men while on vacation.,0.0,0.0,0.0,1.0,0.0,0.0,0.0,0.0,0.0,0.0,0.0,True,False,False,False
Freaky Friday,2003.0,2.0,6.3,151000.0,"An overworked mother and her daughter did not get along. When they switch bodies, each is forced to adapt to the other's life for one freaky Friday.",0.0,0.0,0.0,1.0,0.0,0.0,0.0,1.0,0.0,0.0,0.0,False,True,False,False
The Neon Demon,2016.0,2.0,6.1,103000.0,"An aspiring model, Jesse, is new to Los Angeles. However, her beauty and youth, which generate intense fascination and jealousy within the fashion industry, may prove themselves sinister.",0.0,0.0,0.0,0.0,0.0,0.0,1.0,0.0,1.0,0.0,0.0,False,False,True,False
Crimson Peak,2015.0,2.0,6.5,157000.0,"In the aftermath of a family tragedy, an aspiring author is torn between love for her childhood friend and the temptation of a mysterious outsider. Trying to escape the ghosts of her past, she is swept away to a house that breathes, bleeds - and remembers.",0.0,0.0,0.0,0.0,1.0,0.0,0.0,0.0,1.0,1.0,0.0,False,False,False,True
Reminiscence,2021.0,2.0,5.9,65000.0,"Nick Bannister, a private investigator of the mind, navigates the alluring world of the past when his life is changed by new client Mae. A simple case becomes an obsession after she disappears and he fights to learn the truth about her.",0.0,0.0,1.0,0.0,0.0,1.0,0.0,0.0,0.0,1.0,0.0,False,False,False,True
Smokey and the Bandit,1977.0,2.0,7.0,56000.0,"The Bandit is hired on to run a tractor-trailer full of beer over state lines, in hot pursuit by a pesky sheriff.",1.0,1.0,0.0,1.0,0.0,0.0,0.0,0.0,0.0,0.0,0.0,False,True,False,False
Kiki's Delivery Service,1989.0,2.0,7.8,163000.0,"A young witch, on her mandatory year of independent life, finds fitting into a new community difficult while she supports herself by running an air courier service.",0.0,0.0,0.0,0.0,0.0,0.0,0.0,1.0,0.0,0.0,0.0,False,True,False,False
Black Dynamite,2009.0,3.0,7.4,52000.0,"Black Dynamite is the greatest African-American action star of the 1970s. When his only brother is killed by The Man, it's up to him to find justice.",1.0,0.0,0.0,1.0,0.0,0.0,0.0,0.0,0.0,0.0,0.0,False,False,False,True
Zola,2020.0,3.0,6.5,17000.0,A stripper named Zola embarks on a wild road trip to Florida.,0.0,0.0,0.0,1.0,1.0,0.0,0.0,0.0,0.0,0.0,1.0,False,False,True,False
Joe Kidd,1972.0,3.0,6.4,21000.0,An ex-bounty hunter reluctantly helps a wealthy landowner and his henchmen track down a Mexican revolutionary leader.,0.0,0.0,0.0,0.0,1.0,0.0,0.0,0.0,0.0,0.0,0.0,False,True,False,False
Buffy the Vampire Slayer,1992.0,3.0,5.7,49000.0,Flighty teenage girl Buffy Summers learns that she is her generation's destined battler of vampires.,1.0,0.0,0.0,1.0,0.0,0.0,0.0,1.0,0.0,0.0,0.0,False,False,True,False
Wall Street,1987.0,1.0,7.3,164000.0,"An impatient young stockbroker is willing to do anything to get to the top, including trading on illegal inside information taken through a ruthless, greedy corporate raider who takes the youth under his wing.",0.0,0.0,0.0,0.0,1.0,0.0,0.0,0.0,0.0,0.0,1.0,False,False,False,True
Mad Max Beyond Thunderdome,1985.0,2.0,6.2,147000.0,"After being exiled from the most advanced town in post apocalyptic Australia, a drifter travels with a group of abandoned children to rebel against the town's queen.",1.0,1.0,1.0,0.0,0.0,0.0,0.0,0.0,0.0,0.0,0.0,False,False,False,True
The Square,2017.0,0.0,7.1,77000.0,A prestigious Stockholm museum's chief art curator finds himself in times of both professional and personal crisis as he attempts to set up a controversial new exhibit.,0.0,0.0,0.0,1.0,1.0,0.0,0.0,0.0,0.0,0.0,0.0,False,False,False,True
We Bought a Zoo,2011.0,1.0,7.0,151000.0,"Set in Southern California, a father moves his young family to the countryside to renovate and re-open a struggling zoo.",0.0,0.0,0.0,1.0,1.0,0.0,0.0,0.0,0.0,0.0,0.0,False,True,False,False
Kiss the Girls,1997.0,2.0,6.6,81000.0,Police hunting for a serial kidnapper are helped when a victim manages to escape for the first time.,0.0,0.0,0.0,0.0,1.0,0.0,0.0,0.0,0.0,1.0,1.0,False,False,False,True
Prince of Persia: The Sands of Time,2010.0,2.0,6.6,303000.0,A young fugitive prince and princess must stop a villain who unknowingly threatens to destroy the world with a special dagger that enables the magic sand inside to reverse time.,1.0,1.0,0.0,0.0,0.0,0.0,0.0,1.0,0.0,0.0,0.0,False,True,False,False
Willy's Wonderland,2021.0,3.0,5.5,38000.0,"A quiet drifter is tricked into a janitorial job at the now condemned Willy's Wonderland. The mundane tasks suddenly become an all-out fight for survival against wave after wave of demonic animatronics. Fists fly, kicks land, titans clash -- and only one side will make it out alive.",1.0,0.0,0.0,1.0,0.0,0.0,0.0,0.0,1.0,0.0,0.0,True,False,False,False
Crank,2006.0,3.0,6.9,262000.0,Professional assassin Chev Chelios learns his rival has injected him with a poison that will kill him if his heart rate drops.,1.0,0.0,0.0,0.0,0.0,0.0,1.0,0.0,0.0,0.0,1.0,False,False,True,False
The Apartment,1960.0,1.0,8.3,195000.0,"A Manhattan insurance clerk tries to rise in his company by letting its executives use his apartment for trysts, but complications and a romance of his own ensue.",0.0,0.0,0.0,1.0,1.0,1.0,0.0,0.0,0.0,0.0,0.0,False,True,False,False
Butch Cassidy and the Sundance Kid,1969.0,2.0,8.0,226000.0,"In 1890s Wyoming, Butch Cassidy and The Sundance Kid lead a band of outlaws. When a train robbery goes wrong, they find themselves on the run with a posse hard on their heels. After considering their options, they escape to South America.",0.0,0.0,0.0,0.0,1.0,0.0,0.0,0.0,0.0,0.0,1.0,True,False,False,False
Dennis the Menace,1993.0,2.0,5.7,65000.0,"When his parents must go out of town on business, Dennis stays with Mr. and Mrs. Wilson. He is driving Mr. Wilson crazy, but he is just trying to be helpful, even to the thief who has arrived in town.",0.0,0.0,0.0,1.0,0.0,0.0,0.0,0.0,0.0,0.0,0.0,False,True,False,False
G,2009.0,2.0,5.7,215000.0,"An elite military unit comprised of special operatives known as G.I. Joe, operating out of The Pit, takes on an evil organization led by a notorious arms dealer.",1.0,1.0,1.0,0.0,0.0,0.0,0.0,0.0,0.0,0.0,0.0,False,False,False,True
Bolt,2008.0,2.0,6.8,227000.0,The canine star of a fictional sci-fi/action show that believes his powers are real embarks on a cross country trek to save his co-star from a threat he believes is just as real.,0.0,1.0,0.0,1.0,0.0,0.0,0.0,0.0,0.0,0.0,0.0,False,True,False,False
I Origins,2014.0,2.0,7.3,133000.0,A molecular biologist and his laboratory partner uncover evidence that may fundamentally change society as we know it.,0.0,0.0,0.0,0.0,1.0,1.0,0.0,0.0,0.0,1.0,0.0,False,False,False,True
The Hate U Give,2018.0,1.0,7.5,40000.0,"Starr witnesses the fatal shooting of her childhood best friend Khalil at the hands of a police officer. Now, facing pressure from all sides of the community, Starr must find her voice and stand up for what's right.",0.0,0.0,0.0,0.0,1.0,0.0,0.0,0.0,0.0,0.0,1.0,False,True,False,False
"Sex, Lies, and Videotape",1989.0,2.0,7.2,59000.0,A sexually repressed woman's husband is having an affair with her sister. The arrival of a visitor with a rather unusual fetish changes everything.,0.0,0.0,0.0,0.0,1.0,0.0,0.0,0.0,0.0,0.0,0.0,True,False,False,False
Masterminds,2015.0,2.0,5.8,59000.0,A guard at an armored car company in the Southern U.S. organizes one of the biggest bank heists in American history. Based on the October 1997 Loomis Fargo robbery.,0.0,0.0,0.0,1.0,0.0,0.0,0.0,0.0,0.0,0.0,1.0,False,True,False,False
Blow Out,1981.0,2.0,7.4,62000.0,A movie sound recordist accidentally records the evidence that proves that a car accident was actually murder and consequently finds himself in danger.,0.0,0.0,0.0,0.0,1.0,0.0,0.0,0.0,0.0,1.0,1.0,False,False,True,False
I Am Number Four,2011.0,2.0,6.1,246000.0,"Aliens and their Guardians are hiding on Earth from intergalactic bounty hunters. They can only be killed in numerical order, and Number Four is next on the list. This is his story.",1.0,1.0,1.0,0.0,0.0,0.0,0.0,0.0,0.0,0.0,0.0,False,True,False,False
Star Trek II: The Wrath of Khan,1982.0,2.0,7.7,129000.0,"With the assistance of the Enterprise crew, Admiral Kirk must stop an old nemesis, Khan Noonien Singh, from using the life-generating Genesis Device as the ultimate weapon.",1.0,1.0,1.0,0.0,0.0,0.0,0.0,0.0,0.0,0.0,0.0,False,True,False,False
The Boat That Rocked,2009.0,1.0,7.3,116000.0,"A band of rogue DJs that captivated Britain, playing the music that defined a generation and standing up to a government that wanted classical music, and nothing else, on the airwaves.",0.0,0.0,0.0,1.0,1.0,0.0,0.0,0.0,0.0,0.0,0.0,False,False,False,True
The Lodge,2019.0,2.0,6.0,57000.0,"A soon-to-be stepmom is snowed in with her fiancé's two children at a remote holiday village. Just as relations begin to thaw between the trio, some strange and frightening events take place.",0.0,0.0,0.0,0.0,1.0,0.0,0.0,0.0,1.0,1.0,0.0,False,False,False,True
Day Shift,2022.0,2.0,6.1,89000.0,"A hard-working, blue-collar dad just wants to provide a good life for his quick-witted 10-year-old daughter. His mundane San Fernando Valley pool cleaning job is a front for his real source of income: hunting and killing vampires.",1.0,0.0,0.0,1.0,0.0,0.0,0.0,1.0,0.0,0.0,0.0,True,False,False,False
The Maltese Falcon,1941.0,2.0,8.0,166000.0,"San Francisco private detective Sam Spade takes on a case that involves him with three eccentric criminals, a gorgeous liar and their quest for a priceless statuette, with the stakes rising after his partner is murdered.",0.0,0.0,0.0,0.0,0.0,0.0,0.0,0.0,0.0,1.0,1.0,False,True,False,False
Saint Maud,2019.0,3.0,6.7,46000.0,A pious nurse becomes dangerously obsessed with saving the soul of her dying patient.,0.0,0.0,0.0,0.0,1.0,0.0,0.0,0.0,1.0,1.0,0.0,False,False,True,False
Teen Wolf: The Movie,2023.0,1.0,5.5,14000.0,"A terrifying evil has emerged. The wolves howl once again, but only a Werewolf like Scott McCall, can gather both new allies and reunite trusted friends to fight back against what could be the most powerful and deadliest enemy.",1.0,0.0,0.0,0.0,1.0,0.0,0.0,1.0,0.0,0.0,0.0,True,False,False,False
Alpha Dog,2006.0,1.0,6.9,108000.0,"Johnny and his pals kidnap Jake's 15-year-old brother Zach, then assign his buddy Frankie to be Zach's minder. They develop a brotherly friendship. Zach parties with his captors as things begin to spin out of control.",0.0,0.0,0.0,0.0,1.0,0.0,0.0,0.0,0.0,0.0,1.0,False,False,True,False
Kingpin,1996.0,2.0,6.9,91000.0,"A star bowler whose career was prematurely ""cut off"" hopes to ride a new prodigy to success and riches.",0.0,0.0,0.0,1.0,0.0,0.0,0.0,0.0,0.0,0.0,0.0,False,True,False,False
Father of the Bride,1991.0,2.0,6.5,84000.0,"With his oldest daughter's wedding approaching, a father finds himself reluctant to let go.",0.0,0.0,0.0,1.0,0.0,1.0,0.0,0.0,0.0,0.0,0.0,False,True,False,False
